codigo;nombre_colegio;calendario;genero;localización;naturaleza;codigo_m_municipio
3,05045E+11;I.E. SAN PEDRO CLAVER;A;MIXTO;URBANO;OFICIAL;5045
1,2574E+11;INSTITUCIÓN EDUCATIVA DEPARTAMENTAL GENERAL SANTANDER;A;MIXTO;URBANO;OFICIAL;25740
1,7613E+11;I.E. INMACULADA CONCEPCION;A;MIXTO;RURAL;OFICIAL;76130
1,11001E+11;COLEGIO FERNANDO GONZALEZ OCHOA (IED);A;MIXTO;URBANO;OFICIAL;11001
4,25175E+11;NUEVO GIMNASIO CAMPESTRE MERYLAND;A;MIXTO;RURAL;NO OFICIAL;25175
1,15407E+11;I.E. TEC IND ANTONIO RICAURTE;A;MIXTO;URBANO;OFICIAL;15407
1,156E+11;IE SAN ANTONIO;A;MIXTO;URBANO;OFICIAL;15600
1,11001E+11;COLEGIO INEM SANTIAGO PEREZ (IED);A;MIXTO;URBANO;OFICIAL;11001
3,11001E+11;CENT EDUC LOS ANDES;A;MIXTO;URBANO;NO OFICIAL;11001
1,20001E+11;I E LOPERENA;A;MIXTO;URBANO;OFICIAL;20001
4,2543E+11;COLEGIO SANTA ANGELA MERICI;A;MIXTO;RURAL;NO OFICIAL;11001
1,54001E+11;INST TEC NAL DE COMERCIO;A;MIXTO;URBANO;OFICIAL;54001
3,76001E+11;LICEO MIXTO EMPERADOR II;A;MIXTO;URBANO;NO OFICIAL;76001
1,11001E+11;COLEGIO ANTONIO BARAYA (IED);A;MIXTO;URBANO;OFICIAL;11001
1,11265E+11;COLEGIO GENERAL SANTANDER (IED);A;MIXTO;URBANO;OFICIAL;11001
3,68001E+11;COLEGIO INTEGRAD NUESTRA SEÑORA DEL DIVINO AMOR;A;MIXTO;URBANO;NO OFICIAL;68001
1,15572E+11;IE JOSE ANTONIO GALAN;A;MIXTO;URBANO;OFICIAL;15572
2,05051E+11;I. E. R. EL FILO DE DAMAQUIEL;A;MIXTO;RURAL;OFICIAL;5659
1,73001E+11;INST EDUC EXALUMNAS DE LA PRESENTACION;A;FEMENINO;URBANO;OFICIAL;73001
1,15248E+11;I.E. TECNICA AGROINDUSTRIAL EL ESPINO;A;MIXTO;URBANO;OFICIAL;15248
1,81736E+11;IE CONCENTRACION DE DESARROLLO RURAL;A;MIXTO;URBANO;OFICIAL;81736
1,52612E+11;INSTITUCION EDUCATIVA RICAURTE;A;MIXTO;URBANO;OFICIAL;52612
4,68615E+11;COLEGIO JUAN PABLO II;A;MIXTO;RURAL;OFICIAL;68615
1,76109E+11;NESTOR URBANO TENORIO;A;MIXTO;URBANO;OFICIAL;76109
1,70215E+11;I.E. FRANCISCO JOSE DE CALDAS;A;MIXTO;URBANO;OFICIAL;70215
1,54874E+11;INST. EDUCATIVA MANUEL ANTONIO RUEDA JARA;A;MIXTO;URBANO;OFICIAL;54874
2,19473E+11;INSTITUCION EDUCATIVA EL MANGO;A;MIXTO;RURAL;OFICIAL;19473
1,73001E+11;INST EDUC JOSE CELESTINO MUTIS;A;MIXTO;URBANO;OFICIAL;73001
2,25596E+11;INSTITUCIÓN EDUCATIVA DEPARTAMENTAL AGROPECUARIO  LA SIERRA;A;MIXTO;RURAL;OFICIAL;25596
1,1738E+11;INSTITUCION EDUCATIVA DORADA;A;MIXTO;URBANO;OFICIAL;17380
1,1579E+11;IE JORGE GUILLERMO MOJICA MARQUEZ;A;MIXTO;URBANO;OFICIAL;15790
2,52573E+11;INSTITUCION EDUCATIVA SAN MATEO;A;MIXTO;RURAL;OFICIAL;52573
2,52001E+11;INSTITUCION EDUCATIVA JUAN PABLO II;A;MIXTO;URBANO;OFICIAL;52480
1,25183E+11;I.E.D. RUFINO CUERVO;A;MIXTO;URBANO;OFICIAL;25183
1,63001E+11;CAMILO TORRES;A;MIXTO;URBANO;OFICIAL;63001
1,73124E+11;INSTITUCION EDUCATIVA ISMAEL PERDOMO;A;MIXTO;URBANO;OFICIAL;73124
2,2543E+11;INSTITUCION EDUCATIVA DEPARTAMENTAL SAN PATRICIO PUENTE DE P;A;MIXTO;RURAL;OFICIAL;25799
2,52258E+11;CENTRO EDUCATIVO  FATIMA;A;MIXTO;RURAL;OFICIAL;52258
3,08001E+11;INSTITUCION EDUCATIVA DISTRITAL GOLDA MEIR;A;MIXTO;URBANO;OFICIAL;8001
3,11001E+11;COLEGIO SUPERIOR DE PALERMO;A;MIXTO;URBANO;NO OFICIAL;25178
1,54001E+11;I.E. PADRE MANUEL BRICEÑO JAUREGUI;A;MIXTO;URBANO;OFICIAL;54001
1,11769E+11;COLEGIO HUNZA (IED);A;MIXTO;URBANO;OFICIAL;11001
1,25873E+11;I.E.D. ESCUELA NORMAL SUPERIOR MARIA AUXILIADORA;A;MIXTO;URBANO;OFICIAL;25873
2,11102E+11;COLEGIO SAN BERNARDINO (IED);A;MIXTO;URBANO;OFICIAL;11001
2,86757E+11;I.E.R. AGUA CLARA;A;MIXTO;RURAL;OFICIAL;86757
1,68432E+11;INSTITUTO TECNICO INDUSTRIAL EMETERIO DUARTE SUAREZ;A;MIXTO;URBANO;OFICIAL;68432
3,23555E+11;COLEGIO ANTONIO GALAN;A;MIXTO;URBANO;NO OFICIAL;23555
1,19001E+11;LOS COMUNEROS;A;MIXTO;URBANO;OFICIAL;19001
1,1581E+11;IE LUCAS CABALLERO CALDERON;A;MIXTO;URBANO;OFICIAL;15810
1,15001E+11;GUSTAVO ROJAS PINILLA.;A;MIXTO;URBANO;OFICIAL;15001
3,68679E+11;CORPORACION TECNICA CEDEFOC;A;MIXTO;URBANO;NO OFICIAL;68679
1,05756E+11;I. E.TECNICO INDUSTRIAL ANTONIO ALVAREZ RESTREPO;A;MIXTO;URBANO;OFICIAL;5756
2,81794E+11;INSTITUCION EDUCATIVA AGUSTIN NIETO CABALLERO;A;MIXTO;RURAL;OFICIAL;81794
1,05138E+11;I. E. NICOLAS GAVIRIA;A;MIXTO;URBANO;OFICIAL;5138
1,05895E+11;I. E. SANTO CRISTO DE ZARAGOZA;A;MIXTO;URBANO;OFICIAL;5895
2,76377E+11;IE LA LIBERTAD;A;MIXTO;RURAL;OFICIAL;76377
1,68679E+11;COLEGIO TECNICO NUESTRA SEÑORA DE LA PRESENTACION;A;MIXTO;URBANO;OFICIAL;68679
2,52418E+11;INSTITUCION EDUCATIVA AGROPECUARIO LA PLANADA;A;MIXTO;RURAL;OFICIAL;52418
2,41001E+11;JAIRO MOSQUERA MORENO;A;MIXTO;RURAL;OFICIAL;41001
2,47058E+11;INSTITUCION EDUCATIVA DEPARTAMENTAL LA CANDELARIA;A;MIXTO;RURAL;OFICIAL;47660
1,17088E+11;INSTITUCION EDUCATIVA CRISTO REY;A;MIXTO;URBANO;OFICIAL;17088
1,70429E+11;I.E. NORMAL SUPERIOR DE LA MOJANA;A;MIXTO;URBANO;OFICIAL;70429
1,13549E+11;I.E. MANUEL FRANCISCO OBREGON;A;MIXTO;URBANO;OFICIAL;13549
2,13001E+11;I.E. DE PONTEZUELA;A;MIXTO;RURAL;OFICIAL;13001
1,68081E+11;INSTITUCION EDUCATIVA CIUDADELA DEL MAGDALENA MEDIO;A;MIXTO;URBANO;OFICIAL;68081
1,11001E+11;COLEGIO AULAS COLOMBIANAS SAN LUIS (IED]);A;MIXTO;URBANO;OFICIAL;11001
2,19075E+11;I.E. LA BERMEJA;A;MIXTO;RURAL;OFICIAL;19075
2,66318E+11;IE SANTA ANA;A;MIXTO;RURAL;OFICIAL;66318
2,1978E+11;INSTITUCION EDUCATIVA LA MESETA (ANTES CENTRO EDUCATIVO LA MESETA);A;MIXTO;RURAL;OFICIAL;76364
1,19001E+11;CESAR NEGRET;A;MIXTO;URBANO;OFICIAL;19001
1,05088E+11;IE ATANASIO GIRARDOT;A;MIXTO;URBANO;OFICIAL;5088
1,91407E+11;I.E. INTERNADO INDIGENA SAN JOSE;A;MIXTO;RURAL;OFICIAL;91407
1,25281E+11;INSTITUCION EDUCATIVA DEPARTAMENTAL MARIA MEDINA;A;MIXTO;URBANO;OFICIAL;25281
3,76001E+11;COLEGIO COMPARTIR;A;MIXTO;URBANO;NO OFICIAL;76001
1,23001E+11;I.E. LOS NOGALES;A;MIXTO;URBANO;NO OFICIAL;23001
1,68179E+11;INSTITUTO TECNICO AGROPECUARIO AGATA;A;MIXTO;URBANO;OFICIAL;68179
1,47001E+11;IED MAGDALENA;A;MIXTO;URBANO;OFICIAL;47001
2,23555E+11;I.E. JUAN DE JESÚS NARVÁEZ GIRALDO;A;MIXTO;RURAL;OFICIAL;23555
2,25772E+11;INSTITUCION EDUCATIVA DEPARTAMENTAL PABLO VI;A;MIXTO;RURAL;OFICIAL;25772
3,73268E+11;INSTITUTO DE EDUCACION PARA JOVENES Y ADULTOS  GENESIS;A;MIXTO;URBANO;NO OFICIAL;11001
1,41298E+11;IE BARRIOS UNIDOS;A;MIXTO;URBANO;OFICIAL;41298
1,76109E+11;NORMAL SUPERIOR JUAN LADRILLEROS;A;MIXTO;URBANO;OFICIAL;76109
1,1185E+11;COLEGIO LOS TEJARES (IED);A;MIXTO;URBANO;OFICIAL;11001
1,11001E+11;COLEGIO UNION EUROPEA (IED);A;MIXTO;URBANO;OFICIAL;11001
1,86001E+11;I.E. PIO XII;A;MIXTO;URBANO;OFICIAL;86001
3,1343E+11;CORP EDUC DE MAGANGUE CEDEMAG;A;MIXTO;URBANO;NO OFICIAL;13430
3,08758E+11;LICEO METROPOLITANO DE SOLEDAD;A;MIXTO;URBANO;NO OFICIAL;8758
2,4456E+11;INST ETNOEDUCATIVA LA GLORIA;A;MIXTO;RURAL;OFICIAL;44560
1,05088E+11;I.E. FEDERICO SIERRA ARANGO;A;MIXTO;URBANO;OFICIAL;5088
3,11001E+11;FUNDACIÓN EDUCATIVA PARA EL DESARROLLO INTEGRAL - FEDI;A;MIXTO;URBANO;NO OFICIAL;11001
3,25799E+11;CENTRO DE ESTUDIOS HUITAKA;A;MIXTO;URBANO;NO OFICIAL;25799
1,11102E+11;COLEGIO LUIS LOPEZ DE MESA (IED);A;MIXTO;URBANO;OFICIAL;11001
2,05756E+11;I. E. R. MULATO ABAJO;A;MIXTO;RURAL;OFICIAL;5756
1,54003E+11;COL SANTA BARBARA;A;MIXTO;URBANO;OFICIAL;54003
2,47703E+11;I.E.D. EL HORNO;A;MIXTO;RURAL;OFICIAL;47703
3,11001E+11;COL CENAT;A;MIXTO;URBANO;NO OFICIAL;11001
2,191E+11;INSTITUCION EDUCATIVA SAN JOSE DEL MORRO;A;MIXTO;RURAL;OFICIAL;19100
3,05002E+11;COL NAL DE CAPACITACIÓN ACADEMICA Y CULTURAL CENCAL;A;MIXTO;URBANO;NO OFICIAL;5001
2,76036E+11;IE AGRICOLA CAMPOALEGRE;A;MIXTO;RURAL;OFICIAL;76036
1,63594E+11;MERCADOTECNIA MARIA INMACULADA;A;MIXTO;URBANO;OFICIAL;63594
1,11001E+11;COLEGIO LA CONCEPCION (CED);A;MIXTO;URBANO;OFICIAL;11001
2,05154E+11;I. E. R. VILLA FATIMA ARRIBA;A;MIXTO;RURAL;OFICIAL;5154
2,68152E+11;INSTITUCION EDUCATIVA  AGUATENDIDA;A;MIXTO;RURAL;OFICIAL;68152
1,17001E+11;INSTITUCIÓN EDUCATIVA FE Y ALEGRIA LA PAZ;A;MIXTO;URBANO;OFICIAL;17001
3,11001E+11;COL DE ADMON ROBERT OWEN;A;MIXTO;URBANO;NO OFICIAL;11001
1,76001E+11;INSTITUCION EDUCATIVA TECNICO INDUSTRIAL PEDRO ANTONIO MOLINA;A;MIXTO;URBANO;OFICIAL;76001
2,23068E+11;I.E. EL CEDRO;A;MIXTO;RURAL;OFICIAL;23068
1,05088E+11;IE MARCO FIDEL SUAREZ;A;MIXTO;URBANO;OFICIAL;5088
3,4465E+11;COLEGIO FRANCISCO PALAU Y QUER;A;MIXTO;URBANO;NO OFICIAL;44650
3,11848E+11;COL CLAUSTRO MODERNO;A;MIXTO;URBANO;NO OFICIAL;11001
1,41668E+11;IE LAUREANO GOMEZ;A;MIXTO;URBANO;OFICIAL;41668
2,44847E+11;INSTITUCION ETNOEDUCATIVA INTEGRAN RURAL INTERNADO INDIGENA DE CAMINO VERDE;A;MIXTO;RURAL;OFICIAL;44847
1,05045E+11;I.E. LA PAZ;A;MIXTO;URBANO;OFICIAL;5045
2,1861E+11;I.E.R. DIVINO NIÑO;A;MIXTO;RURAL;OFICIAL;18610
1,6313E+11;INST CALARCA;A;MIXTO;URBANO;OFICIAL;63130
1,85225E+11;IE SALVADOR CAMACHO ROLDAN;A;MIXTO;URBANO;OFICIAL;85225
3,13001E+11;GIMN. LUJAN;A;MIXTO;URBANO;NO OFICIAL;13001
1,18001E+11;INSTITUCION EDUCATIVA LA ESPERANZA;A;MIXTO;URBANO;OFICIAL;18001
1,7667E+11;IE JOSE ANTONIO AGUILERA;A;MIXTO;URBANO;OFICIAL;76670
1,11001E+11;COLEGIO USMINIA  (IED);A;MIXTO;URBANO;OFICIAL;11001
1,54418E+11;COL RAIMUNDO ORDO¿EZ YA¿EZ;A;MIXTO;URBANO;OFICIAL;54418
2,73411E+11;INSTITUCION EDUCATIVA SANTA TERESA;A;MIXTO;RURAL;OFICIAL;73411
2,20175E+11;I. E. SAN JOSE;A;MIXTO;RURAL;OFICIAL;20175
1,05347E+11;I. E. SAN RAFAEL;A;MIXTO;URBANO;OFICIAL;5347
1,17653E+11;INSTITUCION EDUCATIVA ESCUELA NORMAL SUPERIOR MARIA ESCOLASTICA;A;MIXTO;URBANO;OFICIAL;17653
2,05001E+11;INST EDUC CARLOS ALBERTO CALDERON;A;MIXTO;RURAL;OFICIAL;5001
1,7652E+11;IE SANTA BARBARA;A;MIXTO;URBANO;OFICIAL;76520
2,19137E+11;I.E. LOS COMUNEROS;A;MIXTO;RURAL;OFICIAL;19137
2,05756E+11;I. E. TECNICO AGROPECUARIO Y EN SALUD DE SONSÓN;A;MIXTO;RURAL;OFICIAL;5756
1,13873E+11;I.E.T. INDUSTRIAL MOISES CABEZA JUNCO;A;MIXTO;URBANO;OFICIAL;13873
1,27245E+11;IE MARCO FIDEL SUAREZ;A;MIXTO;RURAL;OFICIAL;27245
4,41298E+11;IE AGROP. DEL HUILA;A;MIXTO;RURAL;OFICIAL;41298
2,25878E+11;INSTITUTO DE PROMOCION SOCIAL LIBERIA VIOTA;A;MIXTO;RURAL;OFICIAL;25878
1,13001E+11;INSTITUCION EDUCATIVA MANUELA BELTRAN;A;MIXTO;URBANO;OFICIAL;13001
3,68861E+11;INSTITUTO PEDAGOGICO DE COLOMBIA - INSPEDCOL;A;MIXTO;URBANO;NO OFICIAL;68861
1,41298E+11;IE JENARO DIAZ JORDAN;A;MIXTO;URBANO;OFICIAL;41298
2,0549E+11;I. E. R. LAS CHANGAS;A;MIXTO;RURAL;OFICIAL;5490
1,05873E+11;I. E. VIGIA DEL FUERTE;A;MIXTO;URBANO;OFICIAL;5873
1,52786E+11;INSTITUCION EDUCATIVA PABLO VI;A;MIXTO;URBANO;OFICIAL;52786
2,05093E+11;I E FRANCISCO CESAR;A;MIXTO;RURAL;OFICIAL;5044
3,70001E+11;INS EDU PRE-UNIVERSIDAD ESTUDIANTIL (ANTIGUA PRE-UNIVERSIDAD ESTUDIANTIL);A;MIXTO;URBANO;NO OFICIAL;70001
2,66572E+11;I.E. INTERCULTURAL DOKABU;A;MIXTO;RURAL;OFICIAL;66572
2,054E+11;I. E. MARCO EMILIO LOPEZ GALLEGO;A;MIXTO;RURAL;OFICIAL;5400
2,05858E+11;I. E. JHON F. KENNEDY;A;MIXTO;RURAL;OFICIAL;5858
1,15757E+11;IE ESCUELA NORMAL SUPERIOR;A;MIXTO;URBANO;OFICIAL;15537
1,11001E+11;COLEGIO PABLO NERUDA  (IED);A;MIXTO;URBANO;OFICIAL;11001
3,11001E+11;COLEGIO SUPERIOR SAN CRISTOBAL;OTRO;MIXTO;URBANO;NO OFICIAL;11001
2,68679E+11;I.E. SAN  JUAN BOSCO;A;MIXTO;RURAL;OFICIAL;68679
3,11001E+11;BACHILLERATO DE ADULTOS COLSUBSIDIO;A;MIXTO;URBANO;NO OFICIAL;11001
1,05001E+11;INST EDUC SAMUEL BARRIENTOS RESTREPO;A;MIXTO;URBANO;OFICIAL;5001
2,19809E+11;INSTITUCION EDUCATIVA AGRICOLA SANTA ROSA;A;MIXTO;RURAL;OFICIAL;19809
2,1558E+11;IE DIVINO NIÑO CORMAL;A;MIXTO;RURAL;OFICIAL;15580
1,76622E+11;IE BELISARIO PEÑA PIÑEIRO;A;MIXTO;URBANO;OFICIAL;76622
2,19355E+11;INSTITUCION EDUCATIVA AGRICOLA NUESTRA SENORA DE LA CANDELARIA;A;MIXTO;RURAL;OFICIAL;19355
2,25815E+11;INSTITUCION EDUCATIVA DEPARTAMENTAL RURAL PUBENZA;A;MIXTO;RURAL;OFICIAL;25815
2,19142E+11;I.E. COMERCIAL EL PALO;A;MIXTO;RURAL;OFICIAL;19142
2,2077E+11;I.E. LA CURVA;A;MIXTO;RURAL;OFICIAL;20770
1,05091E+11;I. E. PERLA DEL CITARA;A;MIXTO;URBANO;OFICIAL;5091
1,54001E+11;COL SAN BARTOLOME;A;MIXTO;URBANO;OFICIAL;54001
2,73283E+11;INSTITUCION EDUCATIVA FERNANDO GONZALES MESA;A;MIXTO;RURAL;OFICIAL;73443
1,83479E+11;I.E CERVANTES;A;MIXTO;URBANO;OFICIAL;18479
2,1911E+11;INSTITUCION EDUCATIVA AGROINDUSTRIAL VALENTIN CARABALI;A;MIXTO;RURAL;OFICIAL;19110
1,17001E+11;INSTITUCION EDUCATIVA INSTITUTO MANIZALES;A;MIXTO;URBANO;OFICIAL;17001
3,11001E+11;COL RAFAEL MARIA CARRASQUILLA;A;MIXTO;URBANO;NO OFICIAL;11001
2,73283E+11;INSTITUCION EDUCATIVA REAL CAMPESTRE LA SAGRADA FAMILIA;A;MIXTO;RURAL;OFICIAL;73283
3,08001E+11;COLEGIO COMUNAL MIXTO;A;MIXTO;URBANO;NO OFICIAL;8001
1,05001E+11;INST EDUC RAFAEL GARCIA HERREROS;A;MIXTO;URBANO;OFICIAL;5001
2,86885E+11;I.E.R VILLA AMAZÓNICA;A;MIXTO;RURAL;OFICIAL;86885
1,52696E+11;INSTITUCION EDUCATIVA POLITECNICA SANTA BARBARA;A;MIXTO;URBANO;OFICIAL;52696
1,08001E+11;INST. EDUC. DIST. PAULO FREIRE;A;MIXTO;URBANO;OFICIAL;8001
1,08001E+11;INSTITUCION EDUCATIVA DISTRITAL LAS AMERICAS;A;MIXTO;URBANO;OFICIAL;8001
1,13001E+11;INSTITUCION EDUCATIVA ARROYO DE PIEDRA;A;MIXTO;RURAL;OFICIAL;13001
2,20001E+11;I.E. JOSE CELESTINO MUTIS;A;MIXTO;RURAL;OFICIAL;20001
2,47605E+11;IED BALDOMERO SANIN CANO;A;MIXTO;RURAL;OFICIAL;47605
2,13667E+11;I.E. DE JUANA SANCHEZ;A;MIXTO;RURAL;OFICIAL;13300
4,13673E+11;I.E.T. AGROPECUARIA SAN JOSE DE CLEMENCIA;A;MIXTO;URBANO;OFICIAL;13222
1,27361E+11;IE ANDRES BELLO;A;MIXTO;URBANO;OFICIAL;27361
1,08001E+11;INSTITUCION EDUCATIVA DISTRITAL DE LAS NIEVES;A;MIXTO;URBANO;OFICIAL;8001
2,23555E+11;INSTITUCION EDUCATIVA ARENOSO;A;MIXTO;RURAL;OFICIAL;23555
3,11001E+11;COL CALASANZ;A;MIXTO;URBANO;NO OFICIAL;11001
2,41551E+11;I.E. MUNICIPAL RUMIYACO PACHAKUTI;A;MIXTO;RURAL;OFICIAL;41551
2,05541E+11;I. E. R. PALMIRA;A;MIXTO;RURAL;OFICIAL;5541
2,17873E+11;INSTITUCION EDUCATIVA PARTIDAS;A;MIXTO;RURAL;OFICIAL;17174
3,11001E+11;COLEGIO BILINGÜE LISA MEITNER;A;MIXTO;URBANO;NO OFICIAL;11001
1,73001E+11;INST EDUC TEC ALBERTO CASTILLA;A;MIXTO;URBANO;OFICIAL;73001
2,23001E+11;INSTITUCIÓN EDUCATIVA MORINDO SANTA FE;A;MIXTO;RURAL;OFICIAL;23001
1,08001E+11;INSTITUCION EDUCATIVA DISTRITAL LA MERCED;A;MIXTO;URBANO;OFICIAL;8001
2,08296E+11;INSTITUCION EDUCATIVA ANTONIO NARIÑO DE PALUATO;A;MIXTO;RURAL;OFICIAL;8001
4,27099E+11;CE INDÍGENA DE SALINAS;A;MIXTO;RURAL;OFICIAL;27099
1,11001E+11;COLEGIO MISAEL PASTRANA BORRERO (IED);A;MIXTO;URBANO;OFICIAL;11001
1,6617E+11;INSTITUCION EDUCATIVA SANTA ISABEL;A;MIXTO;URBANO;OFICIAL;66170
3,13001E+11;INSTITUCION EDUCATIVA CLEMENTE MANUEL ZABAL;A;MIXTO;URBANO;OFICIAL;13001
2,1913E+11;I.E. CASAS BAJAS (ANTES C.E. CASA BAJAS);A;MIXTO;RURAL;OFICIAL;19130
3,13001E+11;COLEGIO GORETTI;A;MIXTO;URBANO;NO OFICIAL;13001
1,23001E+11;INSTITUCION EDUCATIVA RANCHO GRANDE;A;MIXTO;URBANO;OFICIAL;23001
1,15368E+11;I.E. LOPEZ QUEVEDO;A;MIXTO;URBANO;OFICIAL;15368
1,76001E+11;INSTITUCIÓN EDUCATIVA TÉCNICO INDUSTRIAL DIEZ DE  MAYO;A;MIXTO;URBANO;OFICIAL;76001
1,05154E+11;I. E. ESCUELA NORMAL SUPERIOR DEL BAJO CAUCA;A;MIXTO;URBANO;OFICIAL;5154
1,68276E+11;INSTITUTO EMPRESARIAL GABRIELA MISTRAL;A;MIXTO;URBANO;OFICIAL;68276
1,27787E+11;IE NORMAL SUPERIOR DEMETRIO SALAZAR CASTILLO;A;MIXTO;URBANO;OFICIAL;27787
2,47245E+11;INSTITUCION EDUCATIVA DEPARTAMENTAL RURAL RITA CUELLO DE VANEGAS;A;MIXTO;RURAL;OFICIAL;47245
2,76497E+11;IE POLICARPA SALAVARRIETA;A;MIXTO;RURAL;OFICIAL;76497
1,11001E+11;ESCUELA PEDAGOGICA INTEGRAL IDIPRON;A;MIXTO;URBANO;NO OFICIAL;11001
2,86885E+11;IER AGROPECUARIA CIUDAD DE VILLAGARZON;A;MIXTO;RURAL;OFICIAL;86885
2,20001E+11;I.E. SAN ISIDRO LABRADOR;A;MIXTO;RURAL;OFICIAL;20001
3,70771E+11;I.E. PUEBLO NUEVO;A;MIXTO;RURAL;OFICIAL;70771
3,18002E+11;CELESTIN FREINET;A;MIXTO;URBANO;NO OFICIAL;18001
2,70001E+11;INSTITUCI¿N EDUCATIVA TECNICO AGROPECUARIO LA ARENA;A;MIXTO;RURAL;OFICIAL;70001
1,70742E+11;INST EDUC ANTONIA SANTOS;A;MIXTO;URBANO;OFICIAL;70742
3,11001E+11;COLEGIO COLSUBSIDIO CHICALÁ;A;MIXTO;URBANO;NO OFICIAL;11001
3,11279E+11;COL PARROQ SAN PEDRO CLAVER;A;MIXTO;URBANO;NO OFICIAL;11001
3,11001E+11;CENT DE CAPACITACION  LTDA (CENCABO);A;MIXTO;URBANO;NO OFICIAL;11001
1,08421E+11;INSTITUCION EDUCATIVA SAN JOSE DE LURUACO;A;MIXTO;URBANO;OFICIAL;8421
1,50001E+11;INSTITUCION EDUCATIVA ANTHONY A PHIPPS;A;MIXTO;URBANO;OFICIAL;50001
1,05837E+11;I.E. FRANCISCO LUIS VALDERRAMA VALDERRAMA;A;MIXTO;URBANO;OFICIAL;5837
3,23001E+11;COL DE LA SGDA FAMILIA;A;FEMENINO;URBANO;NO OFICIAL;23001
1,27001E+11;IE DIOCESANO PEDRO GRAU Y AROLA;A;MIXTO;URBANO;OFICIAL;27001
2,27413E+11;CE INDÍGENA DE ALTO CHITRE;A;MIXTO;RURAL;OFICIAL;27413
3,11001E+11;GIMNASIO MODELIA REAL;A;MIXTO;URBANO;NO OFICIAL;11001
1,11001E+11;COLEGIO MANUELA AYALA DE GAITAN (IED);A;MIXTO;URBANO;OFICIAL;11001
3,47001E+11;COLEGIO EL DIVINO NINO;A;FEMENINO;URBANO;NO OFICIAL;47001
1,50001E+11;INSTITUCION EDUCATIVA TECNICA CATUMARE;A;MIXTO;URBANO;OFICIAL;50001
1,17001E+11;INSTITUCIÓN EDUCATIVA LA SULTANA;A;MIXTO;URBANO;OFICIAL;17001
2,1314E+11;I.E.T.A. EL YUCAL;A;MIXTO;RURAL;OFICIAL;13140
2,85125E+11;IE SIMON BOLIVAR (EL CHIRE);A;MIXTO;RURAL;OFICIAL;85125
3,7652E+11;ACADEMIA COLOMBIANA DE ENSEÑANZA;B;MIXTO;URBANO;NO OFICIAL;76520
3,11001E+11;COLEGIO DOMINGO SAVIO BILINGUAL SCHOOL;A;MIXTO;URBANO;NO OFICIAL;11001
1,66318E+11;IE INSTITUTO GUATICA;A;MIXTO;URBANO;OFICIAL;66318
1,05001E+11;INST EDUC OCTAVIO CALDERON MEJIA;A;MIXTO;URBANO;OFICIAL;5001
1,76109E+11;JOSE MARIA  CABAL;A;MIXTO;URBANO;OFICIAL;76109
2,25269E+11;I.E.M. JUAN XXIII TÉCNICA EN ADMINISTRACIÓN AGROPECUARIA Y PROCESOS INDUSTRIALES;A;MIXTO;RURAL;OFICIAL;25269
1,11001E+11;COLEGIO TECNICO MENORAH (IED);A;FEMENINO;URBANO;OFICIAL;11001
1,11001E+11;COLEGIO MARRUECOS Y MOLINOS (IED);A;MIXTO;URBANO;OFICIAL;11001
2,25875E+11;IED RURAL CUNE;A;MIXTO;RURAL;OFICIAL;25875
1,05148E+11;I. E.  TECNICO INDUSTRIAL JORGE ELIECER GAITAN;A;MIXTO;URBANO;OFICIAL;5148
1,52356E+11;INSTITUCION EDUCATIVA TOMAS ARTURO SANCHEZ;A;MIXTO;URBANO;OFICIAL;52356
2,08137E+11;INSTITUCION EDUCATIVA DE BOHORQUEZ;A;MIXTO;RURAL;OFICIAL;8137
1,70708E+11;I.E. TÉCNICO AGROPECUARIO EL LIMON;A;MIXTO;RURAL;OFICIAL;70708
1,20011E+11;I.E. LAUREANO GOMEZ CASTRO;A;MIXTO;URBANO;OFICIAL;20011
3,17001E+11;COL.  FRANCISCANO AGUSTIN GEMELLI;A;MIXTO;URBANO;NO OFICIAL;17001
2,05282E+11;I. E. LLANO GRANDE;A;MIXTO;RURAL;OFICIAL;5282
2,13549E+11;INSTITUCION EDUCATIVA  DE MINA SECA;A;MIXTO;RURAL;OFICIAL;13810
1,44001E+11;EUGENIA HERRERA;A;MIXTO;RURAL;OFICIAL;44001
3,63001E+11;FRANCISCANO SAN LUIS REY;A;MIXTO;URBANO;NO OFICIAL;63001
1,4456E+11;INSTITUCION EDUCATIVA TECNICA EUSEBIO SEPTIMIO MARI;A;MIXTO;URBANO;OFICIAL;44560
3,11102E+11;GIMN LOS SAUCES;A;MIXTO;URBANO;NO OFICIAL;11001
1,73319E+11;INSTITUCION EDUCATIVA TECNICA COMERCIAL CALDAS;A;MIXTO;URBANO;OFICIAL;73319
3,05001E+11;COLEGIO SAN JOSE DE LAS VEGAS;A;MIXTO;RURAL;NO OFICIAL;5001
3,05001E+11;INST MUSICAL DIEGO ECHAVARRIA;A;MIXTO;URBANO;NO OFICIAL;5001
1,17001E+11;INSTITUCIÓN EDUCATIVA SAN JORGE;A;MIXTO;URBANO;OFICIAL;17001
3,68001E+11;COLEGIO SAN PATRICIO;A;MIXTO;URBANO;NO OFICIAL;68077
1,05856E+11;I. E. RAFAEL URIBE URIBE;A;MIXTO;URBANO;OFICIAL;5856
3,05266E+11;COLEGIO ALCARAVANES;A;MIXTO;RURAL;NO OFICIAL;5266
1,7652E+11;IE CARDENAS MIRRIÑAO;A;MIXTO;URBANO;OFICIAL;76520
4,05267E+11;COLEGIO THEODORO HERTZL;A;MIXTO;URBANO;NO OFICIAL;5001
1,68547E+11;COLEGIO BALBINO GARCIA;A;MIXTO;URBANO;OFICIAL;68547
1,20013E+11;I.E. ANTONIO GALO LAFAURIE CELEDON;A;MIXTO;URBANO;OFICIAL;20013
1,81794E+11;INSTITUCION EDUCATIVA TECNICO INDUSTRIAL FROILAN FARIAS;A;MIXTO;URBANO;OFICIAL;81794
1,44847E+11;INSTITUCION EDUCATIVA JULIA SIERRA IGUARAN;A;MIXTO;URBANO;OFICIAL;44847
1,76147E+11;CIUDAD DE CARTAGO;A;MIXTO;URBANO;OFICIAL;76147
2,44279E+11;INSTITUCION EDUCATIVA ERNESTO PARODI MEDINA;A;MIXTO;URBANO;OFICIAL;44279
1,47001E+11;INSTITUCION EDUCATIVA DISTRITAL LICEO CELEDON;A;MIXTO;URBANO;OFICIAL;47001
1,94001E+11;I.E. LIBERTADORES;A;MIXTO;URBANO;OFICIAL;94001
1,52356E+11;INSTITUCION EDUCATIVA CIUDAD DE IPIALES;A;MIXTO;URBANO;OFICIAL;52356
1,8632E+11;IE JORGE ELIECER GAITAN;A;MIXTO;URBANO;OFICIAL;86320
1,17873E+11;INSTITUCION EDUCATIVA SANTA LUISA DE MARILLAC;A;FEMENINO;URBANO;OFICIAL;17873
3,50318E+11;COLEGIO COFREM GUAMAL;A;MIXTO;URBANO;NO OFICIAL;50318
3,68276E+11;INST SANTA TERESITA;A;MIXTO;URBANO;NO OFICIAL;68547
2,05154E+11;I. E. MARGENTO;A;MIXTO;URBANO;OFICIAL;5154
1,2574E+11;INSTITUCION EDUCATIVA DEPARTAMENTAL PABLO NERUDA;A;MIXTO;URBANO;OFICIAL;25740
1,11001E+11;COLEGIO GUILLERMO CANO ISAZA (IED);A;MIXTO;URBANO;OFICIAL;11001
3,08001E+11;LICEO LOS COMUNEROS;A;MIXTO;URBANO;NO OFICIAL;8001
2,15531E+11;I.E. DE DESARROLLO TECNOLÓGICO AGROPECUARIO;A;MIXTO;RURAL;OFICIAL;15531
3,41006E+11;COL ANDAKI;A;MIXTO;URBANO;NO OFICIAL;41551
3,47189E+11;INSTITUTO PITAGORAS DE SAMOS;A;MIXTO;URBANO;NO OFICIAL;47570
3,11001E+11;GIMNASIO MAYOR DE OCCIDENTE;A;MIXTO;URBANO;NO OFICIAL;11001
3,63001E+11;MARCELINO CHAMPAGNAT;A;MIXTO;URBANO;OFICIAL;63001
1,76001E+11;INSTITUCION EDUCATIVA TECNICO INDUSTRIAL DONALD RODRIGO TAFUR;A;MIXTO;URBANO;OFICIAL;76001
1,50001E+11;COLEGIO SILVIA APONTE RODRIGUEZ;A;MIXTO;URBANO;OFICIAL;50001
1,136E+11;I.E. DE RIO VIEJO;A;MIXTO;URBANO;OFICIAL;13600
1,05001E+11;I.E. MANUEL URIBE ÁNGEL;A;MIXTO;URBANO;OFICIAL;5001
3,05001E+11;UNION PROFESIONAL PARA LA EDUCACION Y EL TRABAJO UPET;OTRO;MIXTO;URBANO;NO OFICIAL;5001
3,11001E+11;COLEGIO SUPERIOR PALERMO SANTA ISABEL;OTRO;MIXTO;URBANO;NO OFICIAL;11001
4,52612E+11;INSTITUCION  AGROPECUARIA COMUNIDAD  INDIGENA  INKAI -AWA;A;MIXTO;RURAL;OFICIAL;52612
2,41551E+11;IE MUNICIPAL GUACACALLO;A;MIXTO;RURAL;OFICIAL;41244
1,73449E+11;INSTITUCION EDUCATIVA TECNICA SUMAPAZ;A;MIXTO;URBANO;OFICIAL;73449
2,52835E+11;IE. SAN JOSE DE CAUNAPI;A;MIXTO;RURAL;OFICIAL;52835
3,08001E+11;CORPORACION INTERNACIONAL DE EDUCACION INTEGRAL ELYON YIRED;A;MIXTO;URBANO;NO OFICIAL;8001
1,4465E+11;INSTITUCION NORMAL SUPERIOR;A;MIXTO;URBANO;OFICIAL;44650
3,0536E+11;INSTITUTO CORFERRINI;A;MIXTO;URBANO;NO OFICIAL;5360
1,08001E+11;INSTITUCION EDUCATIVA DISTRITAL LA LUZ;A;MIXTO;URBANO;OFICIAL;8001
4,19355E+11;I.E. TÉCNICO EMPRESARIAL DE SAN JOSÉ;A;MIXTO;RURAL;OFICIAL;19355
3,11001E+11;CENT DE EDUC FORMAL ROBERT HOOKE;A;MIXTO;URBANO;NO OFICIAL;11001
2,52001E+11;I.E.M. MARCO FIDEL SUÁREZ;A;MIXTO;RURAL;OFICIAL;52001
3,11001E+11;GIMN ARTISTICO SUBA;A;MIXTO;URBANO;NO OFICIAL;11001
1,44078E+11;INSTITUCION EDUCATIVA RURAL  ELOY HERNANDEZ DIAZ;A;MIXTO;RURAL;OFICIAL;44078
1,63001E+11;TERESITA MONTES;A;MIXTO;URBANO;OFICIAL;63001
1,52001E+11;I.E.M. LUIS EDUARDO MORA OSEJO;A;MIXTO;URBANO;OFICIAL;52001
1,41551E+11;IE MUNICIPAL MONTESSORI;A;MIXTO;URBANO;OFICIAL;41551
1,25875E+11;INSTITUCION EDUCATIVA DEPARTAMENTAL ALONSO DE OLALLA;A;MIXTO;URBANO;OFICIAL;25875
1,25841E+11;INSTITUCION EDUCATIVA DEPARTAMENTAL INSTITUTO TECNICO DE ORIENTE;A;MIXTO;RURAL;OFICIAL;25841
1,05001E+11;INST EDUC FE Y ALEGRIA LA CIMA;A;MIXTO;URBANO;OFICIAL;5001
1,86885E+11;IE GUILLERMO VALENCIA;A;MIXTO;URBANO;OFICIAL;86885
2,13001E+11;INSTITUCION EDUCATIVA DE BAYUNCA;A;MIXTO;RURAL;OFICIAL;13001
2,23162E+11;INSTITUCION EDUCATIVA DE SEVERA;A;MIXTO;RURAL;OFICIAL;23162
1,70001E+11;INSTITUCION EDUCATIVA LA UNION;A;MIXTO;URBANO;OFICIAL;70001
2,05837E+11;I.E NUEVO ANTIOQUIA;A;MIXTO;RURAL;OFICIAL;5837
3,13001E+11;CONC. ESCOLAR BERTHA SUTTNER;A;MIXTO;URBANO;NO OFICIAL;13001
2,1343E+11;INST EDUC DE JUAN ARIAS;A;MIXTO;RURAL;OFICIAL;13430
3,47551E+11;INSTITUCION EDUCATIVA DEPARTAMENTAL MARIA INMACULADA;A;MIXTO;URBANO;OFICIAL;47551
2,19517E+11;I.E. BENJAMIN DINDICUE SA TWE SX LUX PKHAAKHENXI YAT;A;MIXTO;RURAL;OFICIAL;19517
2,19698E+11;INST EDUC KLIICHAW SEK (ANTES CENT EDUC);A;MIXTO;RURAL;OFICIAL;19698
1,76001E+11;INSTITUCION EDUCATIVA ALFONSO LOPEZ PUMAREJO;A;MIXTO;URBANO;OFICIAL;76001
3,52356E+11;INSTITUTO DE EDUCACIÓN TECNICA INESUR;A;MIXTO;URBANO;NO OFICIAL;52356
1,19001E+11;EL MIRADOR;A;MIXTO;URBANO;OFICIAL;19001
1,68001E+11;IE NUESTRA SEÑORA DEL PILAR;A;MIXTO;URBANO;OFICIAL;68001
3,23855E+11;INSTITUCION EDUCATIVA CATALINO GULFO;A;MIXTO;URBANO;OFICIAL;23855
2,05837E+11;I.E. SAN VICENTE DEL CONGO;A;MIXTO;RURAL;OFICIAL;5665
2,86757E+11;I.E.R. JORDAN ORTIZ;A;MIXTO;RURAL;OFICIAL;86757
1,6313E+11;TECNOL¿GICO;A;MIXTO;URBANO;OFICIAL;63130
1,664E+11;IE BERNARDO ARIAS TRUJILLO;A;MIXTO;URBANO;OFICIAL;66400
3,25785E+11;GIMNASIO FIRST STEP;A;MIXTO;RURAL;NO OFICIAL;25785
1,15835E+11;IE DIEGO DE TORRES;A;MIXTO;URBANO;OFICIAL;15835
2,1905E+11;I.E. SINAI;A;MIXTO;RURAL;OFICIAL;19050
3,15176E+11;COLEGIO BOLIVARIANO;A;MIXTO;URBANO;NO OFICIAL;15176
1,05475E+11;I. E. MURINDO;A;MIXTO;URBANO;OFICIAL;5475
1,11001E+11;COLEGIO MIGUEL ANTONIO CARO (IED);A;MIXTO;URBANO;OFICIAL;11001
2,15759E+11;INSTITUCION EDUCATIVA MARCO ANTONIO QUIJANO RICO;A;MIXTO;RURAL;OFICIAL;15759
3,11001E+11;CENT JOHANN KEPLER;OTRO;MIXTO;URBANO;NO OFICIAL;11001
2,86757E+11;IE RUR PUERTO COLON SAN MIGUEL;A;MIXTO;RURAL;OFICIAL;86757
3,13001E+11;INSTITUCION EDUCATIVA MADRE GABRIELA DE SAN MARTIN;A;MIXTO;URBANO;OFICIAL;13001
1,05604E+11;I.E. IGNACIO YEPES YEPES;A;MIXTO;URBANO;OFICIAL;5604
1,05001E+11;INST EDUC BARRIO SANTANDER;A;MIXTO;URBANO;OFICIAL;5001
1,05649E+11;I. E. JOAQUIN CARDENAS GOMEZ;A;MIXTO;URBANO;OFICIAL;5649
2,52258E+11;INSTITUCION EDUCATIVO  AGROPECUARIA INGA DE APONTE;A;MIXTO;RURAL;OFICIAL;52258
1,68001E+11;INSTITUTO DE CIENCIAS ADMINISTRATIVAS - INCAD;A;MIXTO;URBANO;NO OFICIAL;68001
2,1911E+11;INSTITUCION EDUCATIVA PARA EL DESARROLLO INTERCULTURAL DE LAS COMUNIDADES INEDIC;A;MIXTO;RURAL;OFICIAL;19110
1,05313E+11;I. E. JORGE ALBERTO GOMEZ GOMEZ;A;MIXTO;URBANO;OFICIAL;5313
1,11001E+11;COLEGIO SAN JOSE DE CASTILLA (IED);A;MIXTO;URBANO;OFICIAL;11001
1,50001E+11;COL LUIS CARLOS GALAN SARMIENTO;A;MIXTO;URBANO;OFICIAL;50001
2,25645E+11;INSTITUCION EDUCATIVA DEPARTAMENTAL MARIANO SANTAMARIA;A;MIXTO;URBANO;OFICIAL;25645
2,76111E+11;IE TULIO ENRIQUE TASCON CHAMBIMBAL;A;MIXTO;RURAL;OFICIAL;76111
2,19824E+11;INST EDUC AGROP PUEBLO TOTORO;A;MIXTO;RURAL;OFICIAL;19824
1,25299E+11;INSTITUCION EDUCATIVA DEPARTAMENTAL TECNICO AGROPECUARIO MARTIN ROMERO;A;MIXTO;URBANO;OFICIAL;25299
2,05604E+11;I. E. LLANO DE CORDOBA;A;MIXTO;URBANO;OFICIAL;5604
2,13074E+11;I.E.T.A. Y PESQUERA SEGUNDO AMARIS MATUTE;A;MIXTO;RURAL;OFICIAL;13074
2,68689E+11;INSTITUCION EDUCATIVA  PALMIRA;A;MIXTO;RURAL;OFICIAL;68689
2,1905E+11;I.E.T. MIGUEL ZAPATA (ANTES I.E. MIGUEL ZAPATA;A;MIXTO;RURAL;OFICIAL;19050
