codigo;nombre_colegio;calendario;genero;localización;naturaleza;codigo_m_municipio
3,13001E+11;COL. SAN  RAFAEL  ARCANGEL;A;MIXTO;URBANO;NO OFICIAL;13001
3,54001E+11;INST EDUC FORMAL DE ADULTOS PROYECCION SIGLO XXI;A;MIXTO;URBANO;NO OFICIAL;54001
3,20001E+11;COL. SAGRADA FAMILIA;A;MIXTO;URBANO;NO OFICIAL;20001
2,85001E+11;IE ANTONIO NARIÑO;A;MIXTO;RURAL;OFICIAL;85001
2,05604E+11;I. E. R. PABLO VI;A;MIXTO;RURAL;OFICIAL;5604
1,52678E+11;INSTITUCION EDUCATIVA POLICARPA SALAVARRIETA;A;MIXTO;URBANO;OFICIAL;52678
1,23182E+11;IE EDUC JOSE YANCES MUTIS;A;MIXTO;URBANO;OFICIAL;23182
1,13894E+11;I.E.T. EN INFORMATICA ANIBAL NOGUERA MENDOZA;A;MIXTO;URBANO;OFICIAL;13894
2,1378E+11;INSTITUCION EDUCATIVA TECNICA AGROPECUARIA DE TALAIGUA VIEJO;A;MIXTO;RURAL;OFICIAL;13780
3,52001E+11;INSTITUTO EDUCATIVO ALBERTO QUIJANO VODNIZA;A;MIXTO;URBANO;NO OFICIAL;52001
2,47545E+11;INSTITUCION EDUCATIVA DEPARTAMENTAL RURAL SAN JOSE;A;MIXTO;RURAL;OFICIAL;47545
2,44848E+11;INSTITUCION ETNOEDUCATIVA INTEGRAL RURAL INTERNADO INDIGENA DEL CABO DE LA VELA;A;MIXTO;RURAL;OFICIAL;44847
3,47288E+11;COLEGIO MANUEL FAUSTINO MOJICA;A;MIXTO;URBANO;NO OFICIAL;47288
3,05001E+11;CENTRO EDUCATIVO PARA LA FORMACION EN COMPETENCIAS  COMPUCEC;A;MIXTO;URBANO;NO OFICIAL;5001
1,25754E+11;I.E. JULIO CÉSAR TURBAY AYALA;A;MIXTO;URBANO;OFICIAL;25754
3,20002E+11;COLEGIO TÉCNICO EMPRESARIAL UPARSISTEM;A;MIXTO;URBANO;NO OFICIAL;20001
1,13001E+11;INSTITUCION EDUCATIVA MANDELA;A;MIXTO;URBANO;OFICIAL;13001
3,73001E+11;INST EDUC FORMAL PARA JOVENES Y ADULTOS PREPAR SAN SEBASTIAN;A;MIXTO;URBANO;NO OFICIAL;73001
1,08001E+11;INSTITUCION EDUCATIVA DISTRITAL SANTA MARIA;A;MIXTO;URBANO;OFICIAL;8001
3,13001E+11;INST. EL LABRADOR;A;MIXTO;URBANO;NO OFICIAL;13001
2,05895E+11;I. E.R. SIMON BOLIVAR;A;MIXTO;RURAL;OFICIAL;5895
3,47001E+11;COLEGIO INSTITUTO TECNICO DEL CARIBE;A;MIXTO;URBANO;NO OFICIAL;47001
3,08001E+11;INSTITUTO LA TRINIDAD;A;MIXTO;URBANO;NO OFICIAL;8001
2,13006E+11;I.E.T. AGROINDUSTRIAL DE ASTILLEROS;A;MIXTO;RURAL;OFICIAL;13655
1,08078E+11;INSTITUCION EDUCATIVA DE BARANOA JULIO PANTOJA MALDONADO;A;MIXTO;URBANO;OFICIAL;8078
1,76001E+11;INSTITUCION EDUCATIVA JOAQUIN DE CAYZEDO Y CUERO;A;MIXTO;URBANO;OFICIAL;76001
1,13433E+11;I.E. CAMILO TORRES DE MAHATES;A;MIXTO;URBANO;OFICIAL;13433
2,70742E+11;I.E. DE VALENCIA;A;MIXTO;RURAL;OFICIAL;70742
1,23001E+11;INSTITUCION EDUCATIVA INEM LORENZO MARIA LLERAS;A;MIXTO;URBANO;OFICIAL;23001
2,1343E+11;INST EDUC TECNICO ACUICOLA DE CASCAJAL;A;MIXTO;RURAL;OFICIAL;13430
1,70508E+11;I.E. SAN JOSE;A;MIXTO;URBANO;OFICIAL;70508
3,08758E+11;CENTRO DE EDUCACION PARA ADULTOS NUEVO MILENIO;A;MIXTO;URBANO;NO OFICIAL;8758
2,2367E+11;CENTRO EDUCATIVO SANTANDER;A;MIXTO;RURAL;OFICIAL;23815
2,2367E+11;CENT EDUC BERLIN;A;MIXTO;RURAL;OFICIAL;23670
1,2366E+11;I.E. SAN JOSE;A;MIXTO;URBANO;OFICIAL;23660
1,52001E+11;I.E.M. CENT DE INTEGRACION POPULAR;A;MIXTO;URBANO;OFICIAL;52001
1,13001E+11;INSTITUCION EDUCATIVA FERNANDO DE LA VEGA;A;MIXTO;URBANO;OFICIAL;13001
1,11769E+11;COLEGIO ANIBAL FERNANDEZ DE SOTO (IED);A;MIXTO;URBANO;OFICIAL;11001
3,2529E+11;COL CENT DE ESTUDIOS HUITAKA;A;MIXTO;URBANO;NO OFICIAL;25290
1,68081E+11;INSTITUCION EDUCTIVA MPAL CAMILO TORRES RESTREPO;A;MIXTO;URBANO;OFICIAL;68081
2,17388E+11;INSTITUCION EDUCATIVA LLANADAS;A;MIXTO;RURAL;OFICIAL;17388
2,05101E+11;I. E. R. LA ERMITA;A;MIXTO;RURAL;OFICIAL;5101
3,70001E+11;INS EDU LICEO MODERNO DEL LITORAL (ANTIGUO LICEO MODERNO DEL LITORAL);A;MIXTO;URBANO;NO OFICIAL;70001
3,05088E+11;IE LICEO ANTIOQUEÑO;A;MIXTO;URBANO;OFICIAL;5088
2,68615E+11;COLEGIO  LLANO DE PALMAS;A;MIXTO;RURAL;OFICIAL;68615
2,66318E+11;IE SAN CLEMENTE;A;MIXTO;RURAL;OFICIAL;66318
3,68307E+11;UNITECNICAS;A;MIXTO;URBANO;NO OFICIAL;68307
3,11769E+11;COL BENPOSTA NACION DE MUCHACHOS;A;MIXTO;URBANO;NO OFICIAL;11001
3,11001E+11;LIC DE LA UNIVERSIDAD CATOLICA;A;MIXTO;URBANO;NO OFICIAL;11001
1,76823E+11;IE FRAY JOSE JOAQUIN ESCOBAR;A;MIXTO;URBANO;OFICIAL;76823
2,20228E+11;I.E. AGUSTIN RANGEL;A;MIXTO;RURAL;OFICIAL;20228
1,05266E+11;INSTITUCION EDUCATIVA MARIA POUSSEPIN;A;MIXTO;URBANO;OFICIAL;5266
1,76001E+11;INSTITUCION EDUCATIVA GENERAL ALFREDO VASQUEZ COBO;A;MIXTO;URBANO;OFICIAL;76001
2,23182E+11;INSTITUCION EDUCATIVA SAN JUAN DEL CHORRILLO;A;MIXTO;RURAL;OFICIAL;23182
1,23162E+11;I.E. DOLORES GARRIDO;A;MIXTO;URBANO;OFICIAL;23162
3,25286E+11;I E SANTA ANA;A;MIXTO;URBANO;NO OFICIAL;25286
2,52418E+11;INSTITUCION EDUCATIVA LA PAZ;A;MIXTO;RURAL;OFICIAL;52418
2,19256E+11;I.E. LOS ANAYES;A;MIXTO;RURAL;OFICIAL;19256
1,73268E+11;INSTITUCION EDUCATIVA TECNICA FELIX TIBERIO GUZMAN;A;MIXTO;URBANO;OFICIAL;73268
1,11001E+11;COLEGIO RAFAEL URIBE URIBE (IED);A;MIXTO;URBANO;OFICIAL;11001
2,25398E+11;INSTITUCION EDUCATIVA RURAL DEPARTAMENTAL AGUABLANCA;A;MIXTO;RURAL;OFICIAL;25398
1,05756E+11;I. E. ROSA MARIA HENAO PAVAS;A;MIXTO;URBANO;OFICIAL;5756
3,76001E+11;CENTRO EDUCATIVO ALFA Y OMEGA;A;MIXTO;URBANO;NO OFICIAL;76001
2,13074E+11;I.E. LAS DELICIAS MINAS DE SANTA CRUZ;A;MIXTO;RURAL;OFICIAL;13074
1,17001E+11;INSTITUCIÓN EDUCATIVA SAN PIO X;A;MIXTO;URBANO;OFICIAL;17001
1,11001E+11;COLEGIO MIGUEL DE CERVANTES SAAVEDRA (IED);A;MIXTO;URBANO;OFICIAL;11001
1,08433E+11;INSTITUCION EDUCATIVA EVA RODRIGUEZ;A;MIXTO;URBANO;OFICIAL;8433
2,0549E+11;I. E. R. MULATICOS PIEDRECITAS;A;MIXTO;RURAL;OFICIAL;5490
2,13052E+11;I.E.T. ACUICOLA DE ROCHA;A;MIXTO;RURAL;OFICIAL;13052
2,19517E+11;I.E. SAT¿ WESX ZUUN;A;MIXTO;RURAL;OFICIAL;19517
2,41132E+11;IE LA VEGA;A;MIXTO;RURAL;OFICIAL;41132
1,05837E+11;I.E. SAN MARTIN DE PORRES;A;MIXTO;URBANO;OFICIAL;5837
2,68547E+11;I.E. LA VEGA;A;MIXTO;RURAL;OFICIAL;68547
1,11001E+11;COLEGIO ALBERTO LLERAS CAMARGO (IED);A;MIXTO;URBANO;OFICIAL;11001
1,17042E+11;INSTITUCION EDUCATIVA DE OCCIDENTE;A;MIXTO;URBANO;OFICIAL;17042
1,68755E+11;INSTITUTO TECNICO INDUSTRIAL MONSEÑOR CARLOS ARDILA GARCIA;A;MIXTO;URBANO;OFICIAL;68755
1,764E+11;IE JUAN DE DIOS GIRON;A;MIXTO;URBANO;OFICIAL;76400
2,25754E+11;INSTITUCION EDUCATIVA MANUELA BELTRAN;A;MIXTO;URBANO;OFICIAL;25754
3,73483E+11;SERVICIO EDUCATIVO NAL DE ADULTOS SENDAS;A;MIXTO;URBANO;NO OFICIAL;73483
3,13001E+11;INSTITUCION EDUCATIVA FE Y ALEGRIA EL PROGRESO;A;MIXTO;URBANO;OFICIAL;13001
1,41615E+11;IE MISAEL PASTRANA B;A;MIXTO;URBANO;OFICIAL;41615
2,05837E+11;I.E. RIO GRANDE;A;MIXTO;RURAL;OFICIAL;5837
2,27413E+11;IE INDÍGENA DE PLAYON;A;MIXTO;RURAL;OFICIAL;27413
3,52207E+11;INSTITUCION EDUCATIVA LOS LIBERTADORES;A;MIXTO;URBANO;OFICIAL;52207
3,23672E+11;INST RAFAEL LORDUY ROMERO;A;MIXTO;URBANO;NO OFICIAL;23672
2,50573E+11;IE REMOLINO;A;MIXTO;RURAL;OFICIAL;50573
3,05001E+11;COLEGIO LUIS AMIGO Y FERRER;A;MIXTO;URBANO;NO OFICIAL;5001
3,76001E+11;CENTRO EDUCATIVO LEONARDO DA VINCI;A;MIXTO;URBANO;NO OFICIAL;76001
3,76001E+11;INSTITUTO LA RIVERA;A;MIXTO;URBANO;NO OFICIAL;76001
1,47189E+11;IE LA ALIANZA;A;MIXTO;URBANO;OFICIAL;47189
3,19456E+11;INSTITUCION EDUCATIVA PROVIDENCIA MIRANDA;A;MIXTO;URBANO;NO OFICIAL;19455
2,20013E+11;C.E. TUTACHE;A;MIXTO;RURAL;OFICIAL;20013
2,17513E+11;INSTITUCION EDUCATIVA MARISCAL ROBLEDO;A;MIXTO;RURAL;OFICIAL;17513
2,19364E+11;INSTITUCION EDUCATIVA KWESX U´JHTHESX UUS YATXNXI WILDER FABIAN HURTADO;A;MIXTO;RURAL;OFICIAL;19364
1,25862E+11;INSTITUCION EDUCATIVA DEPARTAMENTAL  FIDEL LEON TRIANA;A;MIXTO;URBANO;OFICIAL;25862
2,6644E+11;INST  AGRIC  MARSELLA;A;MIXTO;URBANO;OFICIAL;66440
3,11001E+11;INST TEC IND CENTRO DON BOSCO;A;MASCULINO;URBANO;NO OFICIAL;11001
1,11001E+11;COLEGO ORLANDO FALS BORDA (ANTES BARRANQUILLITA) (IED);A;MIXTO;URBANO;OFICIAL;11001
1,05001E+11;INST EDUC RAMON GIRALDO CEBALLOS;A;MIXTO;URBANO;OFICIAL;5001
4,17873E+11;COLEGIO SAN GABRIEL;A;MIXTO;RURAL;NO OFICIAL;17873
1,05854E+11;I. E. VALDIVIA;A;MIXTO;URBANO;OFICIAL;5854
1,8525E+11;IE SAGRADO CORAZON;A;MIXTO;URBANO;OFICIAL;85250
1,05321E+11;I. E. NUESTRA SENORA DEL PILAR;A;MIXTO;URBANO;OFICIAL;5321
1,05001E+11;INST EDUC JUAN DE DIOS CARVAJAL;A;MIXTO;URBANO;OFICIAL;5001
2,17524E+11;INSTITUTO MONSEÑOR ALFONSO DE LOS RIOS;A;MIXTO;RURAL;OFICIAL;17524
2,05615E+11;I. E. GILBERTO ECHEVERRY MEJIA;A;MIXTO;RURAL;OFICIAL;5615
1,504E+11;IE DE LEJANIAS;A;MIXTO;URBANO;OFICIAL;50400
3,13001E+11;COL. NTRA. SRA. DE FATIMA DE LA POL NAL;A;MIXTO;URBANO;OFICIAL;13001
1,91001E+11;INSTITUCION EDUCATIVA SAGRADO CORAZON DE JESUS;A;MIXTO;URBANO;OFICIAL;91001
1,05001E+11;INST EDUC LUCRECIO JARAMILLO VELEZ;A;MIXTO;URBANO;OFICIAL;5001
2,4465E+11;INSTITUCION ETNOEDUCATIVO RURAL E INTERNADO ZHARNEKA.;A;MIXTO;RURAL;OFICIAL;44650
1,11001E+11;COLEGIO CLEMENCIA HOLGUIN DE URDANETA (IED);A;MIXTO;URBANO;OFICIAL;11001
2,68855E+11;INSTITUCION EDUCATIVA  EL MORRO;A;MIXTO;RURAL;OFICIAL;68855
2,76233E+11;I.E. SAN PEDRO CLAVER;A;MIXTO;RURAL;OFICIAL;76233
3,76109E+11;CENTRO EDUCATIVO SANTA ELENA;A;MIXTO;URBANO;NO OFICIAL;76109
1,66001E+11;IE RAFAEL URIBE URIBE;A;MIXTO;URBANO;OFICIAL;66001
1,63001E+11;CRISTOBAL COLON;A;MIXTO;URBANO;OFICIAL;63001
2,23466E+11;INSTITUCION EDUCATIVA  BELEN;A;MIXTO;RURAL;OFICIAL;23466
1,76001E+11;INSTITUCION EDUCATIVA CIUDAD CORDOBA;A;MIXTO;URBANO;OFICIAL;76001
1,13001E+11;I. E. JORGE ARTEL;A;MIXTO;URBANO;NO OFICIAL;13001
2,66572E+11;IE COLEGIO ETNOEDUCATIVO EMBERA CHAMI;A;MIXTO;RURAL;OFICIAL;66572
1,68001E+11;IE GUSTAVO COTE URIBE;A;MIXTO;URBANO;OFICIAL;68001
2,1365E+11;I.E. DE SANTA ROSA;A;MIXTO;RURAL;OFICIAL;13650
2,2358E+11;INSTITUCION EDUCATIVA JUAN PABLO II;A;MIXTO;RURAL;OFICIAL;23580
2,27001E+11;IE BERNARDINO BECERRA RODRIGUEZ;A;MIXTO;URBANO;OFICIAL;27600
3,50001E+11;COLEGIO LATINOAMERICANO;A;MIXTO;URBANO;NO OFICIAL;50001
1,2367E+11;IE ALIANZA;A;MIXTO;URBANO;OFICIAL;23670
2,73043E+11;INSTITUCION EDUCATIVA TECNICA AGROPECUARIA JUAN CARLOS BARRAGAN TRONCOSO;A;MIXTO;RURAL;OFICIAL;73043
3,11001E+11;INST IP EDUCANDO LA JUVENTUD FUTURO DE COLOMBIA;A;MIXTO;URBANO;NO OFICIAL;11001
2,7652E+11;IE SEBASTIAN DE BELALCAZAR;A;MIXTO;RURAL;OFICIAL;76520
2,23686E+11;INSTITUCION EDUCATIVA  EL GAS;A;MIXTO;RURAL;OFICIAL;23686
2,05051E+11;I. E. R. LA TRINIDAD;A;MIXTO;RURAL;OFICIAL;5051
1,13836E+11;I.E.T. AGROPECUARIA LA BUENA ESPERANZA;A;MIXTO;URBANO;OFICIAL;13836
2,548E+11;INST AGRICOLA REGION DEL CATATUMBO;A;MIXTO;RURAL;OFICIAL;54800
3,27413E+11;IE ATRATO DE LLORO;A;MIXTO;URBANO;OFICIAL;27413
2,47189E+11;INSTITUCION ETNOEDUCATIVA DEPARTAMENTAL DE SOPLADOR;A;MIXTO;RURAL;OFICIAL;47980
2,47692E+11;INSTITUCION EDUCATIVA DEPARTAMENTAL LAS MERCEDES;A;MIXTO;RURAL;OFICIAL;47692
2,25148E+11;INSTITUCION EDUCATIVA DEPARTAMENTAL NOVILLERO;A;MIXTO;RURAL;OFICIAL;25148
2,05387E+11;I. E. R. LA SIERRA;A;MIXTO;RURAL;OFICIAL;5585
2,8501E+11;I.E. LA TURUA;A;MIXTO;RURAL;OFICIAL;85010
1,05107E+11;I. E. ANTONIO ROLDAN BETANCUR;A;MIXTO;URBANO;OFICIAL;5107
2,86865E+11;I.E.R. JOSE ASUNCION SILVA;A;MIXTO;RURAL;OFICIAL;86865
2,41359E+11;IE BORDONES;A;MIXTO;RURAL;OFICIAL;41359
1,6313E+11;ROMAN MARIA VALENCIA;A;MIXTO;URBANO;OFICIAL;63130
2,23686E+11;INSTITUCION EDUCATIVA AMAURY GARC¿A BURGOS;A;MIXTO;RURAL;OFICIAL;23686
4,20621E+11;I.E.T. AGRP SAN JOSE DE ORIENTE;A;MIXTO;RURAL;OFICIAL;20621
3,76109E+11;GIMNASIO BUENAVENTURA;A;MIXTO;URBANO;NO OFICIAL;76109
2,05147E+11;I.E.R. EL CERRO;A;MIXTO;RURAL;OFICIAL;5147
2,278E+11;IE DESARROLLO DE BALBOA;A;MIXTO;RURAL;OFICIAL;27800
2,05051E+11;I. E. R. PAJILLAL;A;MIXTO;RURAL;OFICIAL;5051
3,13001E+11;INSTITUTO SIGMUND FREUD;A;MIXTO;URBANO;NO OFICIAL;13001
1,50251E+11;IE OVIDIO DECROLY;A;MIXTO;URBANO;OFICIAL;50251
2,05847E+11;I. E. R.  VALENTINA FIGUEROA;A;MIXTO;RURAL;OFICIAL;5847
3,76001E+11;COL TEC CIAL SAN MARCOS DE LEON;A;MIXTO;URBANO;NO OFICIAL;76001
3,41001E+11;COLEGIO COLOMBO INGLES DEL HUILA Y CIA LTDA;A;MIXTO;URBANO;NO OFICIAL;41001
2,76869E+11;IE ANTONIO JOSE DE SUCRE;A;MIXTO;RURAL;OFICIAL;76869
2,6313E+11;SAN BERNARDO;A;MIXTO;RURAL;OFICIAL;63130
2,66594E+11;IE INSTITUTO INTEGRADO IRRA;A;MIXTO;RURAL;OFICIAL;66594
3,11001E+11;COLEGIO CAPACITACION 2000;A;MIXTO;URBANO;NO OFICIAL;11001
1,05001E+11;INST EDUC LOMA HERMOSA;A;MIXTO;RURAL;OFICIAL;5001
2,1913E+11;I.E. LA MESETA;A;MIXTO;RURAL;OFICIAL;19130
1,05861E+11;I. E. SAN JOSE DE VENECIA;A;MIXTO;URBANO;OFICIAL;5861
1,68307E+11;I.E. COLEGIO JUAN CRISTOBAL  MARTINEZ;A;MIXTO;URBANO;OFICIAL;68307
2,76109E+11;RAUL OREJUELA BUENO;A;MIXTO;RURAL;OFICIAL;76109
2,2366E+11;CENTRO EDUCATIVO EL CRUCERO;A;MIXTO;RURAL;OFICIAL;70708
2,25175E+11;I.E. FAGUA;A;MIXTO;RURAL;OFICIAL;25175
1,4465E+11;INSTITUCION EDUCATIVA MARIA EMMA MENDOZA;A;MIXTO;URBANO;OFICIAL;44650
1,25473E+11;I.E.  JUAN LUIS LONDOÑO DE LA CUESTA;A;MIXTO;URBANO;OFICIAL;25473
3,13001E+11;COL. TRINITARIO;A;MIXTO;URBANO;NO OFICIAL;13001
3,47001E+11;INSTITUTO LAS AMERICAS;A;MIXTO;URBANO;NO OFICIAL;47001
3,11001E+11;ATENEO INTEGRAL ANA B. DE FLOREZ;A;MIXTO;URBANO;NO OFICIAL;11001
1,13657E+11;INSTITUCION EDUCATIVA TECNICA RODOLFO BARRIOS CABRERA;A;MIXTO;URBANO;OFICIAL;13657
2,52317E+11;INSTITUCION EDUCATIVA TECNICA AGROPECUARIA SAN DIEGO;A;MIXTO;RURAL;OFICIAL;52317
1,52585E+11;INSTITUCION EDUCATIVA TECNICA AGRICOLA JOSE MARIA HERNANDEZ;A;MIXTO;URBANO;OFICIAL;52585
3,52356E+11;COLEGIO SAN FELIPE NERI;A;MIXTO;URBANO;NO OFICIAL;52356
1,11001E+11;COLEGIO JOHN F. KENNEDY (IED);A;MIXTO;URBANO;OFICIAL;11001
3,52838E+11;INSTITUCION EDUCATIVA INSTITUTO TERESIANO;A;MIXTO;URBANO;OFICIAL;52838
1,52001E+11;I.E.M. AURELIO ARTURO MARTINEZ;A;MIXTO;URBANO;OFICIAL;52001
3,11001E+11;COL EL CARMELO;A;FEMENINO;URBANO;NO OFICIAL;11001
2,05147E+11;I.E.R. LA PROVINCIA;A;MIXTO;RURAL;OFICIAL;5147
3,05318E+11;INSTITUTO CORFERRINI;A;MIXTO;URBANO;NO OFICIAL;5315
1,6617E+11;INSTITUCION EDUCATIVA SANTA SOFIA;A;MIXTO;URBANO;OFICIAL;66170
2,08638E+11;INSTITUCION EDUCATIVA SIMON BOLIVAR DE COLOMBIA;A;MIXTO;RURAL;OFICIAL;8638
3,11001E+11;INST LABERINTO DE LA CULTURA;A;MIXTO;URBANO;NO OFICIAL;11001
1,6882E+11;COLEGIO INTEGRADO RAFAEL URIBE URIBE;A;MIXTO;URBANO;OFICIAL;68820
3,4443E+11;LICEO MODERNO MADRE LAURA;A;MIXTO;URBANO;NO OFICIAL;44430
2,4443E+11;INSTITUCION EDUCATIVA INDIGENA NO. 3;A;MIXTO;RURAL;OFICIAL;44430
2,136E+11;I.E. COBADILLO;A;MIXTO;RURAL;OFICIAL;13600
3,13688E+11;CORPORACION E INSTITUCION EDUCATIVA ALBERT EINSTEIN C.I.N.E.A.E;A;MIXTO;URBANO;NO OFICIAL;13688
1,52001E+11;I.E.M. LA ROSA;A;MIXTO;URBANO;OFICIAL;52001
3,20787E+11;I.E. ARSENIO GUTIERREZ BARBOSA;A;MIXTO;RURAL;OFICIAL;20787
1,66001E+11;IE KENNEDY;A;MIXTO;URBANO;OFICIAL;66001
1,73001E+11;INST EDUC ANTONIO REYES UMAÑA;A;MIXTO;URBANO;OFICIAL;73001
2,52227E+11;I.E. INDÍGENA AGROAMBIENTAL MAYKER;A;MIXTO;RURAL;OFICIAL;52227
2,52357E+11;I.E.R. EL EMPALME;A;MIXTO;RURAL;OFICIAL;52356
2,11102E+11;COLEGIO BOSANOVA (IED);A;MIXTO;URBANO;OFICIAL;11001
1,94001E+11;I.E. CUSTODIO GARCIA ROVIRA;A;MIXTO;URBANO;OFICIAL;94001
1,0536E+11;INSTITUCION EDUCATIVA AVELINO SALDARRIAGA;A;MIXTO;URBANO;OFICIAL;5360
3,11001E+11;CENT CIAL MADRE ELISA RONCALLO;A;FEMENINO;URBANO;NO OFICIAL;11001
1,08001E+11;INSTITUCION EDUCATIVA DISTRITAL DE FORMACION INTEGRAL;A;FEMENINO;URBANO;OFICIAL;8758
3,11001E+11;COL PARROQ DEL INMACULADO CORAZON DE MARIA;A;MIXTO;URBANO;NO OFICIAL;11001
3,17874E+11;CORPORACION EDUCATIVA PROGRESAR CALDAS DE COLOMBIA COEDPRO;A;MIXTO;URBANO;NO OFICIAL;17873
1,05001E+11;INST EDUC ROSALIA SUAREZ;A;MIXTO;URBANO;OFICIAL;5001
4,41001E+11;SAN LUIS BELTRAN;A;MIXTO;RURAL;OFICIAL;41001
2,47541E+11;INSTITUCION EDUCATIVA DEPARTAMENTAL TECNICA AGROECOLOGICA JOSE DADUL;A;MIXTO;RURAL;OFICIAL;47541
2,41503E+11;IE SAN  ROQUE;A;MIXTO;RURAL;OFICIAL;41503
2,86568E+11;IE RUR CIUDAD SANTANA;A;MIXTO;RURAL;OFICIAL;86568
1,6313E+11;ANTONIO NARI¿O;A;MIXTO;URBANO;OFICIAL;63130
2,1185E+11;COLEGIO RUR QUIBA ALTA (IED);A;MIXTO;RURAL;OFICIAL;11001
3,05308E+11;INSTITUTO CORFERRINI;A;MIXTO;URBANO;NO OFICIAL;5308
1,68051E+11;COLEGIO SAN LUIS;A;MIXTO;URBANO;OFICIAL;68051
1,63001E+11;CIUDADELA DEL SUR;A;MIXTO;URBANO;OFICIAL;63001
1,50325E+11;IE JORGE ELIECER GAITAN;A;MIXTO;URBANO;OFICIAL;50325
3,25286E+11;COL DE FORMACION INTEGRAL SEMBRADORES DE PAZ;A;MIXTO;URBANO;NO OFICIAL;25473
1,76001E+11;INSTITUCION EDUCATIVA ISAIAS GAMBOA;A;MIXTO;URBANO;OFICIAL;76001
1,25823E+11;INSTITUCION EDUCATIVA DEPARTAMENTAL DE TOPAIPI;A;MIXTO;URBANO;OFICIAL;25823
2,68406E+11;COLEGIO  PORTUGAL;A;MIXTO;RURAL;OFICIAL;68406
1,05001E+11;INST EDUC COLEGIO LOYOLA PARA LA CIENCIA Y LA INNOVACIÓN;A;MIXTO;URBANO;OFICIAL;5001
2,76403E+11;IE SAN JOSE;A;MIXTO;RURAL;OFICIAL;76497
2,0549E+11;I. E. R. LA COMARCA;A;MIXTO;RURAL;OFICIAL;5490
1,11001E+11;COLEGIO EDUARDO SANTOS (IED);A;MIXTO;URBANO;OFICIAL;11001
1,76109E+11;JOSE RAMON BEJARANO;A;MIXTO;URBANO;OFICIAL;76109
2,0589E+11;I. E. R. PRESBITERO EDUARDO ZULUAGA;A;MIXTO;RURAL;OFICIAL;5890
1,76892E+11;IE MAYOR DE YUMBO;A;MIXTO;URBANO;OFICIAL;76892
1,76001E+11;INSTITUCIÓN EDUCATIVA BARTOLOMÉ LOBOGUERRERO;A;MIXTO;URBANO;OFICIAL;76001
3,11001E+11;COLEGIO COLSUBSIDIO CIUDADELA;A;MIXTO;URBANO;NO OFICIAL;11001
1,54498E+11;COL AGUSTINA FERRO;A;MIXTO;URBANO;OFICIAL;54498
1,05647E+11;I. E. SAN ANDRES;A;MIXTO;URBANO;OFICIAL;5647
1,05001E+11;INST EDUC FE Y ALEGRIA AURES;A;MIXTO;URBANO;OFICIAL;5001
1,23807E+11;INS EDU EL PARAISO;A;MIXTO;URBANO;OFICIAL;23807
1,63212E+11;CIUDELA JOSE MARIA CORDOBA;A;MIXTO;URBANO;OFICIAL;63212
1,76111E+11;IE GRAN COLOMBIA;A;MIXTO;URBANO;OFICIAL;76111
1,66383E+11;IE LICEO DE OCCIDENTE;A;MIXTO;URBANO;OFICIAL;66383
1,18247E+11;I.E. MARCO FIDEL SUAREZ;A;MIXTO;URBANO;OFICIAL;18247
2,95001E+11;I.E. JOSE MIGUEL LOPEZ CALLE;A;MIXTO;RURAL;OFICIAL;95001
1,19809E+11;INSTITUCION EDUCATIVA COMERCIAL SANTA CLARA DE ASIS;A;MIXTO;URBANO;OFICIAL;19809
1,68547E+11;INSTITUTO LUIS CARLOS GALAN SARMIENTO DEL SUR;A;MIXTO;URBANO;OFICIAL;68547
1,68001E+11;I E PILOTO SIMON BOLIVAR;A;MIXTO;URBANO;OFICIAL;68001
1,50001E+11;I.E. LAS PALMAS;A;MIXTO;URBANO;OFICIAL;50001
1,11001E+11;COLEGIO JUAN EVANGELISTA GOMEZ (IED);A;MIXTO;URBANO;OFICIAL;11001
2,23001E+11;INSTITUCION EDUCATIVA  EL TIGRE VILLA CLARETH;A;MIXTO;RURAL;OFICIAL;23001
2,15464E+11;I.E. TUNJUELO;A;MIXTO;RURAL;OFICIAL;15464
1,0519E+11;I. E. CISNEROS;A;MIXTO;URBANO;OFICIAL;5190
1,19698E+11;I.E. TECNICO AMBIENTAL FERNANDEZ GUERRA;A;MIXTO;URBANO;OFICIAL;19698
2,50001E+11;ISAAC TACHA NI¿O;A;MIXTO;RURAL;OFICIAL;50001
3,11001E+11;LIC LA CORUÑA;A;MIXTO;URBANO;NO OFICIAL;11001
1,95025E+11;I.E. LATORRE GOMEZ;A;MIXTO;URBANO;OFICIAL;95025
1,15516E+11;I.E. TOMAS VASQUEZ RODRIGUEZ;A;MIXTO;URBANO;OFICIAL;15516
2,41668E+11;IE OBANDO;A;MIXTO;RURAL;OFICIAL;41668
1,27495E+11;IE LITORAL PACIFICO DE NUQUI;A;MIXTO;URBANO;OFICIAL;27495
3,25473E+11;LICEO LOREN´S;A;MIXTO;URBANO;NO OFICIAL;25473
1,05001E+11;I.E. FATIMA NUTIBARA;A;MIXTO;URBANO;OFICIAL;5001
3,27787E+11;IE NUESTRA SEÑORA DE LA POBREZA DE TADO;A;MIXTO;URBANO;OFICIAL;27787
1,54051E+11;I.E. SAN JUAN BOSCO;A;MIXTO;URBANO;OFICIAL;54051
2,19142E+11;I.E. LA NIÑA MARIA - CRUCERO DE GUALI;A;MIXTO;RURAL;OFICIAL;19142
1,05045E+11;I.E. SAN JOSÉ OBRERO;A;MIXTO;URBANO;OFICIAL;5045
2,17433E+11;INSTITUCION EDUCATIVA LLANADAS;A;MIXTO;RURAL;OFICIAL;17433
1,11001E+11;COLEGIO ACACIA II (IED);A;MIXTO;URBANO;OFICIAL;11001
1,76111E+11;IE ACADEMICO;A;MIXTO;URBANO;OFICIAL;76306
1,66001E+11;INST EDUC SAN FERNANDO;A;MIXTO;URBANO;OFICIAL;66001
3,11001E+11;COLEGIO AGUSTINIANO TAGASTE;A;MIXTO;URBANO;NO OFICIAL;11001
1,05055E+11;I. E. SANTA TERESA;A;MIXTO;RURAL;OFICIAL;5055
1,13647E+11;INSTITUCION EDUCATIVA FRANCISCO  DE PAULA SANTANDER;A;MIXTO;URBANO;OFICIAL;13647
2,0566E+11;I.E.R. ALTAVISTA;A;MIXTO;RURAL;OFICIAL;5660
1,11769E+11;COLEGIO GERARDO PAREDES (IED);A;MIXTO;URBANO;OFICIAL;11001
1,25754E+11;INSTITUCION EDUCATIVA CIUDAD LATINA;A;MIXTO;URBANO;OFICIAL;25754
3,19001E+11;COLEGIO CAMPESTRE HISPANO DEL NORTE;A;MIXTO;URBANO;NO OFICIAL;76001
2,47707E+11;INSTITUCION EDUCATIVA DEPARTAMENTAL RURAL NUESTRA SE¿ORA DEL ROSARIO;A;MIXTO;RURAL;OFICIAL;47720
1,54398E+11;INST EDUCATIVA COL FRAY JOSE MARIA AREVALO;A;MIXTO;URBANO;OFICIAL;54398
2,13667E+11;I.E. DE EL PEÑONCITO;A;MIXTO;RURAL;OFICIAL;13268
2,1911E+11;I.E. AGROAMBIENTAL LA NUEVA ESPERANZA;A;MIXTO;RURAL;OFICIAL;19110
2,73001E+11;INST  EDUC SAN BERNARDO;A;MIXTO;RURAL;OFICIAL;73001
2,08606E+11;INSTITUCION EDUCATIVA CIEN PESOS Y LAS TABLAS;A;MIXTO;RURAL;OFICIAL;8606
3,11001E+11;COL JAZMIN OCCIDENTAL;A;MIXTO;URBANO;NO OFICIAL;11001
4,13001E+11;FUNDACION EDUCATIVA INSTITUTO ECOLÓGICO BARBACOAS;A;MIXTO;RURAL;NO OFICIAL;13001
3,52585E+11;INSTITUTO DE EDUCACIÓN TÉCNICA PARA EL DESARROLLO INCATD;A;MIXTO;URBANO;NO OFICIAL;52001
3,11001E+11;LIC ARKADIA COLOMBIA;A;MIXTO;URBANO;NO OFICIAL;11001
1,05001E+11;INST EDUC DINAMARCA;A;MIXTO;URBANO;OFICIAL;5001
3,76001E+11;FUNDACION ESCOLAR NELSON MANDELA;A;MIXTO;URBANO;NO OFICIAL;76122
2,73217E+11;INSTITUCION EDUCATIVA CHENCHE BALSILLAS;A;MIXTO;RURAL;OFICIAL;73217
2,0512E+11;I. E. GASPAR DE RODAS;A;MIXTO;URBANO;OFICIAL;5120
2,41524E+11;IE NILO;A;MIXTO;RURAL;OFICIAL;41524
1,66594E+11;IE  NUCLEO ESCOLAR RURAL;A;MIXTO;URBANO;OFICIAL;66594
2,4102E+11;IE LA PERDIZ;A;MIXTO;RURAL;OFICIAL;41020
1,0536E+11;INSTITUCION EDUCATIVA FELIPE DE RESTREPO;A;MIXTO;URBANO;OFICIAL;5360
2,05615E+11;I. E. LA MOSQUITA;A;MIXTO;RURAL;OFICIAL;5615
3,11001E+11;GIMNASIO MONTREAL;A;MIXTO;URBANO;NO OFICIAL;11001
1,11001E+11;COLEGIO JOSE ASUNCION SILVA (IED);A;MIXTO;URBANO;OFICIAL;11001
2,13244E+11;INSTITUCION EDUCATIVA SAN ISIDRO;A;MIXTO;RURAL;OFICIAL;13244
1,11001E+11;COLEGIO NESTOR FORERO ALCALA  (IED);A;MIXTO;URBANO;OFICIAL;11001
3,54172E+11;INSTITUTO ESTUDIANTIL REGIONAL INTER;A;MIXTO;URBANO;NO OFICIAL;54172
3,25754E+11;COLEGIO JORGE ISAACS;A;MIXTO;URBANO;NO OFICIAL;25754
1,15763E+11;I.E. TECNICA PABLO VI;A;MIXTO;URBANO;OFICIAL;15763
2,76616E+11;IE NEMESIO RODRIGUEZ ESCOBAR;A;MIXTO;RURAL;OFICIAL;76616
2,76318E+11;IE JOSE CELESTINO MUTIS;A;MIXTO;RURAL;OFICIAL;76318
1,11001E+11;COLEGIO FRANCISCO DE PAULA SANTANDER (IED);A;MIXTO;URBANO;OFICIAL;11001
2,41676E+11;IE SAN JOAQUIN;A;MIXTO;RURAL;OFICIAL;41676
3,11001E+11;COL PEDAG DEL ESPIRITU SANTO COPES;A;MIXTO;URBANO;NO OFICIAL;11001
1,66318E+11;IE MARIA REINA;A;MIXTO;URBANO;OFICIAL;66318
2,7613E+11;IE RODRIGO LLOREDA CAICEDO;A;MIXTO;RURAL;OFICIAL;76130
1,50313E+11;IE CAMILO TORRES;A;MIXTO;URBANO;OFICIAL;50313
1,83094E+11;I.E AGROTECNICO MIXTO;A;MIXTO;URBANO;OFICIAL;18094
3,68001E+11;COL  LA SALLE;A;MIXTO;URBANO;NO OFICIAL;68001
2,76111E+11;IE EL PLACER;A;MIXTO;RURAL;OFICIAL;76111
1,13001E+11;INSTITUCION EDUCATIVA FULGENCIO LEQUERICA  VELEZ;A;MIXTO;URBANO;OFICIAL;13001
1,11001E+11;COLEGIO ESTRELLA DEL SUR (IED);A;MIXTO;URBANO;OFICIAL;11001
2,86568E+11;I.E.R. SANTA ISABEL;A;MIXTO;RURAL;OFICIAL;86568
2,52835E+11;I.E. LA ENSENADA;A;MIXTO;RURAL;OFICIAL;52835
1,76001E+11;INSTITUCION EDUCATIVA SAN JUAN BAUTISTA DE LA SALLE;A;MIXTO;URBANO;OFICIAL;76001
3,73001E+11;COLEGIO LOS SAMANES;A;MIXTO;URBANO;NO OFICIAL;73001
2,41615E+11;IE RIVERITA;A;MIXTO;RURAL;OFICIAL;41615
1,05125E+11;I. E. SAN JUAN BOSCO;A;MIXTO;URBANO;OFICIAL;5125
6,25269E+11;CENT DE EDUCACION PROACTIVA CEP;A;MIXTO;URBANO;NO OFICIAL;25269
3,76001E+11;INSTITUTO TÉCNICO RJ DEL SABER;A;MIXTO;URBANO;NO OFICIAL;76001
1,27001E+11;IE ARMANDO LUNA ROA;A;MIXTO;URBANO;OFICIAL;27001
2,76109E+11;NUESTRA SEÑORA DEL PERPETUO SOCORRO;A;MIXTO;RURAL;OFICIAL;76109
3,25286E+11;COLEGIO COOPERATIVO COMUNAL DE FUNZA;A;MIXTO;URBANO;NO OFICIAL;25286
2,19698E+11;INST EDUC AGROP SA T WE SX YAT;A;MIXTO;RURAL;OFICIAL;19698
1,11279E+11;COLEGIO ANTONIO VAN UDEN  (IED);A;MIXTO;URBANO;OFICIAL;11001
1,05001E+11;INST EDUC RODRIGO ARENAS BETANCUR;A;MIXTO;URBANO;OFICIAL;5001
3,20002E+11;COLEGIO ESESCO;A;MIXTO;URBANO;NO OFICIAL;20001
3,19001E+11;FUNDACIÓN EDUCATIVA ANDRÉS BELLO;A;MIXTO;URBANO;NO OFICIAL;19001
1,68207E+11;COLEGIO NUESTRA SEÑORA DE LA CONCEPCION;A;MIXTO;URBANO;OFICIAL;68207
3,11001E+11;INST SUSANA WESLEY;A;MIXTO;URBANO;NO OFICIAL;11001
1,66001E+11;IE JORGE ELIECER GAITAN;A;MIXTO;URBANO;OFICIAL;66001
3,11001E+11;COL TALLER PSICOPEDAG DE LOS ANDES;A;MIXTO;URBANO;NO OFICIAL;11001
2,1911E+11;INSTITUCION EDUCATIVA AGROPECUARIA BRISAS DE MARY LOPEZ;A;MIXTO;RURAL;OFICIAL;19110
3,70001E+11;CENTRO EDUCATIVO JOSE ANTONIO PAEZ (ANTIGUA ESCUELA JOSE ANTONIO PAEZ);A;MIXTO;URBANO;NO OFICIAL;70001
3,68081E+11;LIC NUEVA GENERACION;A;MIXTO;URBANO;NO OFICIAL;68081
1,83094E+11;I.E GABRIELA MISTRAL;A;MIXTO;URBANO;OFICIAL;18094
2,19585E+11;I.E.A. PALETARA;A;MIXTO;RURAL;OFICIAL;19585
2,5254E+11;INSTITUCIÓN EDUCATIVA RESTREPO;A;MIXTO;RURAL;OFICIAL;52540
3,19001E+11;COLEGIO SAN CARLOS;A;MIXTO;URBANO;NO OFICIAL;19001
2,13442E+11;I.E. DE RETIRO NUEVO;A;MIXTO;RURAL;OFICIAL;13442
2,0549E+11;I. E. R. PUEBLO NUEVO;A;MIXTO;RURAL;OFICIAL;5490
2,9976E+11;INSTITUCION EDUCATIVA INTERNADO AVELINO ALVAREZ TORRES;A;MIXTO;RURAL;OFICIAL;99773
2,20001E+11;I.E. LAUREANO MARTINEZ;A;MIXTO;RURAL;OFICIAL;20570
1,17442E+11;INSTITUCION EDUCATIVA MARMATO;A;MIXTO;URBANO;OFICIAL;17442
2,97001E+11;I.E.D. TAPURUCUARA;A;MIXTO;RURAL;OFICIAL;97001
1,0536E+11;INSTITUCION EDUCATIVA LOMA LINDA;A;MIXTO;URBANO;OFICIAL;5360
1,13683E+11;INSTITUCION EDUCATIVA SANTA ROSA DE LIMA;A;MIXTO;URBANO;OFICIAL;13683
1,08001E+11;INSTITUCION EDUCATIVA DISTRITAL DE EXPERIENCIAS PEDAGOGICAS;A;MIXTO;URBANO;OFICIAL;8001
2,47189E+11;INSTITUCION EDUCATIVA DEPARTAMENTAL RURAL LAS MERCEDES;A;MIXTO;RURAL;OFICIAL;47980
1,19001E+11;FRANCISCO ANTONIO DE ULLOA;A;MIXTO;URBANO;OFICIAL;19397
1,73547E+11;INSTITUCION EDUCATIVA TECNICA FABIO LOZANO Y LOZANO;A;MIXTO;URBANO;OFICIAL;73547
2,52786E+11;INSTITUCION EDUCATIVA  EL MANZANO;A;MIXTO;RURAL;OFICIAL;52786
2,1913E+11;I.E. ORTEGA (C.E. ORTEGA);A;MIXTO;RURAL;OFICIAL;19130
3,52203E+11;INSTITUCION EDUCATIVA LEOPOLDO LOPEZ ALVAREZ;A;MIXTO;URBANO;OFICIAL;52203
1,08001E+11;INSTITUCION EDUCATIVA DISTRITAL LA CONCEPCION;A;MIXTO;URBANO;OFICIAL;8001
2,13673E+11;I.E.T. ACUICOLA MIGUEL NEVADO NEVADO DE GALERAZAMBA;A;MIXTO;RURAL;OFICIAL;13673
2,08638E+11;INSTITUCION EDUCATIVA SAN PEDRO CLAVER DE CASCAJAL;A;MIXTO;RURAL;OFICIAL;8638
2,2367E+11;INSTITUCION EDUCATIVA PATIO BONITO NORTE;A;MIXTO;RURAL;OFICIAL;23670
2,52687E+11;INSTITUCION EDUCATIVA NUESTRA SEÑORA DEL CARMEN;A;MIXTO;RURAL;OFICIAL;52687
2,952E+11;I.E. FRANCISCO DE PAULA SANTADER;A;MIXTO;RURAL;OFICIAL;95200
