codigo;nombre_colegio;calendario;genero;localización;naturaleza;codigo_m_municipio
1,47707E+11;INSTITUCION EDUCATIVA DEPARTAMENTAL ANTONIO BRUJES CARMONA;A;MIXTO;URBANO;OFICIAL;47707
3,11001E+11;GIMN SAN ANGELO;A;MIXTO;URBANO;NO OFICIAL;11001
1,13001E+11;INSTITUCION EDUCATIVA PROMOCION SOCIAL DE C/GENA.;A;MIXTO;URBANO;OFICIAL;13001
1,11001E+11;COLEGIO VIRGINIA GUTIERREZ DE PINEDA (IED);A;MIXTO;URBANO;OFICIAL;11001
1,11001E+11;COLEGIO PALERMO  IEDIP  (IED);A;MIXTO;URBANO;OFICIAL;11001
3,08759E+11;INSTITUTO PARA LA CAPACITACIÓN SIMÓN RODRÍGUEZ;A;MIXTO;URBANO;NO OFICIAL;8758
3,76001E+11;CORPORACION EDUCATIVA ADVENTISTA- CÁMBULOS;A;MIXTO;URBANO;NO OFICIAL;76001
1,68001E+11;IE ESCUELA NORMAL SUPERIOR DE BUCARAMANGA;A;MIXTO;URBANO;OFICIAL;68001
1,25754E+11;INSTITUCION EDUCATIVA INTEGRADO DE SOACHA;A;MIXTO;URBANO;OFICIAL;25754
3,70001E+11;CENTRO EDUCATIVO LICEO PANAMERICANO;A;MIXTO;URBANO;NO OFICIAL;70001
2,13006E+11;I.E.T.A. Y MINERA MONTECRISTO;A;MIXTO;URBANO;OFICIAL;13458
2,47161E+11;INSTITUCION EDUCATIVA DEPARTAMENTAL LUZ MARINA CABALLERO;A;MIXTO;RURAL;OFICIAL;47205
3,11001E+11;COLEGIO UNILATINA;A;MIXTO;URBANO;NO OFICIAL;11001
3,11001E+11;COL JOSE JOAQUIN VARGAS;A;MIXTO;URBANO;NO OFICIAL;11001
1,05001E+11;INST EDUC JUAN MARIA CESPEDES;A;MIXTO;URBANO;OFICIAL;5001
2,2025E+11;I.E. BENITO RAMOS TRESPALACIOS;A;MIXTO;RURAL;OFICIAL;20250
1,15238E+11;COLEGIO GUILLERMO LEON VALENCIA;A;MIXTO;URBANO;OFICIAL;15238
3,41001E+11;COL  COOPERATIVO UTRAHUILCA;A;MIXTO;URBANO;NO OFICIAL;41001
1,76606E+11;IE JORGE ELIECER GAITAN;A;MIXTO;URBANO;OFICIAL;76606
3,08001E+11;INSTITUTO REINA DE LOS ANGELES;A;MIXTO;URBANO;NO OFICIAL;8001
3,11001E+11;LIC PSICOPEDAG TIBABITA;A;MIXTO;URBANO;NO OFICIAL;11001
1,11001E+11;COLEGIO RAMON DE ZUBIRIA (IED);A;MIXTO;URBANO;OFICIAL;11001
1,08297E+11;INSTITUCIÓN EDUCATIVA TECNICA VILLA OLIMPICA;A;MIXTO;URBANO;OFICIAL;8296
1,08001E+11;INSTITUCION EDUCATIVA DISTRITAL SAGRADO CORAZON DE JESUS;A;MIXTO;URBANO;OFICIAL;8001
3,85001E+11;COLEGIO SAN MATEO APOSTOL;A;MIXTO;URBANO;NO OFICIAL;85001
1,11279E+11;COLEGIO INTEGRADO DE FONTIBON IBEP  (IED);A;MIXTO;URBANO;OFICIAL;11001
1,08078E+11;INSTITUCION EDUCATIVA TECNICO INDUSTRIAL PEDRO A. OÑORO DE BARANOA;A;MIXTO;URBANO;OFICIAL;8078
3,11001E+11;COL SUPERIOR DE OCCIDENTE;A;MIXTO;URBANO;NO OFICIAL;11001
2,19212E+11;INSTITUCION EDUCATIVA CARMENCITA CARDONA DE GUTIERREZ;A;MIXTO;RURAL;OFICIAL;19212
1,85001E+11;IE BRAULIO GONZALEZ;A;MIXTO;RURAL;OFICIAL;85001
1,08433E+11;INSTITUCION EDUCATIVA ANTONIA SANTOS;A;MIXTO;URBANO;OFICIAL;8433
1,23855E+11;INS EDUCATIVA JOSE MARIA CARBONELL;A;MIXTO;URBANO;OFICIAL;23855
1,54518E+11;COL AGUEDA GALLARDO DE VILLAMIZAR;A;MIXTO;URBANO;OFICIAL;54518
2,23417E+11;IE EUGENIO SANCHEZ CARDENAS;A;MIXTO;RURAL;OFICIAL;23417
1,25754E+11;INSTITUCION EDUCATIVA  NUEVO COMPARTIR;A;MIXTO;URBANO;OFICIAL;25754
3,08001E+11;INSTITUTO CENTRO DE SISTEMAS LTDA.;A;MIXTO;URBANO;NO OFICIAL;8001
2,08638E+11;INSTITUCION EDUCATIVA SAN JOSE DE AGUADA DE PABLO;A;MIXTO;RURAL;OFICIAL;8638
1,11001E+11;ESC. NORMAL SUPERIOR DISTRITAL MARIA MONTESSORI (IED);A;MIXTO;URBANO;OFICIAL;11001
1,20011E+11;I.E. SAN MIGUEL;A;MIXTO;URBANO;OFICIAL;20011
3,13052E+11;CONCENTRACION EDUCATIVA CAROLINA GAMERO PEREZ;A;MIXTO;URBANO;NO OFICIAL;13052
1,25286E+11;I.E.D. MIGUEL ANTONIO CARO;A;MIXTO;URBANO;OFICIAL;25286
3,63001E+11;NUESTRA SEÑORA DE FATIMA;A;MIXTO;RURAL;OFICIAL;63001
3,81001E+11;COLEGIO COMFIAR;A;MIXTO;URBANO;NO OFICIAL;81001
1,08001E+11;INSTITUCION EDUCATIVA DISTRITAL FUNDACION PIES DESCALZOS;A;MIXTO;URBANO;OFICIAL;8001
1,54498E+11;COL JOSE EUSEBIO CARO;A;MIXTO;URBANO;OFICIAL;54498
1,08758E+11;INSTITUCION EDUCATIVA FRANCISCO JOSE DE CALDAS;A;MIXTO;URBANO;OFICIAL;8758
1,11001E+11;COLEGIO RODRIGO ARENAS BETANCOURT  (IED);A;MIXTO;URBANO;OFICIAL;11001
1,68001E+11;IE TEC DAMASO ZAPATA;A;MIXTO;URBANO;OFICIAL;68001
1,50568E+11;IE JORGE ELIECER GAITAN;A;MIXTO;URBANO;OFICIAL;50568
2,70713E+11;INST EDUC SAN ANTONIO;A;MIXTO;RURAL;OFICIAL;70713
3,08001E+11;COLEGIO SANTA MARIA DE LA PROVIDENCIA;A;MIXTO;URBANO;NO OFICIAL;8001
1,2025E+11;I.E. NACIONALIZADO EL PASO;A;MIXTO;URBANO;OFICIAL;20250
1,25817E+11;INSTITUCION EDUCATIVA DEPARTAMENTAL DE BACHILLERATO TECNICO COMERCIA;A;MIXTO;URBANO;OFICIAL;25817
1,13244E+11;I.E. MANUEL EDMUNDO MENDOZA;A;MIXTO;URBANO;OFICIAL;13244
2,70001E+11;INSTITUCION EDUCATIVA TECNICO AGROPECUARIO LA GALLERA;A;MIXTO;RURAL;OFICIAL;70001
3,41298E+11;COL. COOP. LA PRESENTACION;A;MIXTO;URBANO;NO OFICIAL;41298
2,23686E+11;INSTITUCION EDUCATIVA VALPARAISO;A;MIXTO;RURAL;OFICIAL;23686
3,11001E+11;LIC PARROQ SAN GREGORIO MAGNO;A;MIXTO;URBANO;NO OFICIAL;11001
3,68001E+11;COLEGIO GIMNASIO SUPERIOR;A;MIXTO;URBANO;NO OFICIAL;68001
3,05615E+11;INSTITUCION EDUCATIVA JUAN SEBASTIAN DE CENSA;A;MIXTO;URBANO;NO OFICIAL;5615
3,08001E+11;LICEO MIXTO DE LA COSTA;A;MIXTO;URBANO;NO OFICIAL;8001
1,76002E+11;INSTITUCION EDUCATIVA LLANO VERDE;A;MIXTO;URBANO;OFICIAL;76001
1,54498E+11;COL FRANCISCO FERNANDEZ DE CONTRERAS;A;MIXTO;URBANO;OFICIAL;54498
1,20002E+11;I.E. MAYOR DE VALLEDUPAR CÉSAR POMPEYO MENDOZA HINOJOSA;A;MIXTO;URBANO;OFICIAL;20001
1,11001E+11;COLEGIO NACIONAL NICOLAS ESGUERRA (IED);A;MASCULINO;URBANO;OFICIAL;11001
1,11001E+11;COLEGIO O.E.A (IED);A;MIXTO;URBANO;OFICIAL;11001
2,50573E+11;IE YAALIAKEISY;A;MIXTO;RURAL;OFICIAL;50573
1,50223E+11;IE JOSE EUSTASIO RIVERA;A;MIXTO;URBANO;OFICIAL;50223
3,81737E+11;GIMNASIO PSICOPEDAGOGICO BILINGÜE HEBRON;A;MIXTO;URBANO;NO OFICIAL;81736
1,70823E+11;I.E. HERIBERTO GARCIA GARRIDO;A;MIXTO;URBANO;OFICIAL;70823
3,08573E+11;I.E. SAN NICOLAS DE TOLENTINO;A;MIXTO;URBANO;OFICIAL;8573
1,11001E+11;COLEGIO BRASILIA - BOSA (IED);A;MIXTO;URBANO;OFICIAL;11001
1,05088E+11;IE PLAYA RICA;A;MIXTO;URBANO;OFICIAL;5088
3,70001E+11;INSTITUCION EDUCATIVA COMFASUCRE(ANTES CENTRO DOCEMTE CONFASUCRE);A;MIXTO;URBANO;NO OFICIAL;70001
1,54405E+11;INST TECNICO MUNICIPAL DE LOS PATIOS;A;MIXTO;URBANO;OFICIAL;54405
1,25386E+11;INSTITUCION EDUCATIVA DEPTAL FRANCISCO JULIAN OLAYA;A;MIXTO;URBANO;OFICIAL;25386
3,20001E+11;LICEO GABRIEL GARCIA MARQUEZ;A;MIXTO;URBANO;NO OFICIAL;20001
3,27001E+11;COMFACHICO;A;MIXTO;URBANO;NO OFICIAL;27001
3,11001E+11;COLEGIO RETOS;A;MIXTO;URBANO;NO OFICIAL;11001
1,76616E+11;IE PRIMITIVO CRESPO;A;MIXTO;URBANO;OFICIAL;76616
3,08758E+11;INSTITUTO BADEL POWELL;A;MIXTO;URBANO;NO OFICIAL;8758
2,44035E+11;INSTITUCION ETNOEDUCATIVA RURAL AKUAIPA INTERNADO INDIGENA DE ALBANIA;A;MIXTO;RURAL;OFICIAL;44279
1,20001E+11;IE LA ESPERANZA;A;MIXTO;URBANO;OFICIAL;20001
1,20001E+11;IE PEDRO CASTRO MONSALVO;A;MIXTO;URBANO;OFICIAL;20001
3,11001E+11;GIMN SANTA CRUZ;A;MIXTO;URBANO;NO OFICIAL;11001
1,7067E+11;I.E. MILLAN VARGAS;A;MIXTO;URBANO;OFICIAL;70670
2,23068E+11;IE LUIS FERNANDO GONZALEZ B (ANTES SAN JOSE);A;MIXTO;URBANO;OFICIAL;23350
3,08758E+11;INSTITUTO TECNICO EDGAR MORIN;A;MIXTO;URBANO;NO OFICIAL;8758
3,08001E+11;COLEGIO SANTA CECILIA;A;MIXTO;URBANO;NO OFICIAL;8001
3,81001E+11;I.E.A. MUNICIPAL;A;MIXTO;RURAL;OFICIAL;81001
2,23189E+11;INSTITUCION EDUCATIVA EL SIGLO;A;MIXTO;RURAL;OFICIAL;23189
1,25754E+11;INSTITUCION EDUCATIVA CIUDADELA  SUCRE;A;MIXTO;URBANO;OFICIAL;25754
1,44078E+11;INSTITUCI¿N EDUCATIVA PAULO VI;A;MIXTO;URBANO;OFICIAL;44078
2,2366E+11;INSTITUCION EDUCATIVA RANCHERIA;A;MIXTO;URBANO;OFICIAL;23660
1,70001E+11;INSTITUCION EDUCATIVA RAFAEL NU¿EZ;A;MIXTO;URBANO;OFICIAL;70001
1,50573E+11;IE ENRIQUE OLAYA HERRERA;A;MIXTO;URBANO;OFICIAL;50573
1,25491E+11;INSTITUCION EDUCATIVA DEPARTAMENTAL;A;MIXTO;URBANO;OFICIAL;25491
2,68081E+11;INSTITUCION EDUCATIVA SAN MARCOS EL LLANITO;A;MIXTO;RURAL;OFICIAL;68081
1,13836E+11;INSTITUCION EDUCATIVA CRISANTO LUQUE;A;MIXTO;URBANO;OFICIAL;13836
1,23162E+11;IE 24 DE MAYO;A;MIXTO;URBANO;OFICIAL;23162
3,19318E+11;I.E. SAN JOSE;A;MIXTO;URBANO;OFICIAL;19318
1,13001E+11;INSTITUCION EDUCATIVA SOLEDAD ROMAN DE NU?EZ;A;MIXTO;URBANO;OFICIAL;13001
3,70708E+11;GIMNASIO DEL SAN JORGE;A;MIXTO;URBANO;NO OFICIAL;70708
1,13244E+11;I.E.T.A. Y  PARTICIPACION COMUNITARIA JULIO CESAR TURBAY;A;MIXTO;URBANO;OFICIAL;13244
3,13001E+11;INST. DE ENSEÑANZA MADDOX (ANTES INST. AGAZZI);A;MIXTO;URBANO;NO OFICIAL;13001
3,08433E+11;C. E. DE ADULTOS CARL FRIEDICH GAUSS;A;MIXTO;URBANO;NO OFICIAL;8433
2,23417E+11;IE EL CARITO;A;MIXTO;RURAL;OFICIAL;23417
1,19455E+11;INSTITUCION EDUCATIVA LEOPOLDO PIZARRO GONZALEZ;A;MIXTO;URBANO;OFICIAL;19455
3,13001E+11;COL. SALESIANO SAN PEDRO CLAVER;A;MASCULINO;URBANO;NO OFICIAL;13001
1,11001E+11;COLEGIO CARLOS PIZARRO LEON GOMEZ (IED);A;MIXTO;URBANO;OFICIAL;11001
4,47001E+11;COLEGIO GIMNASIO CAMPESTRE EL RODADERO;A;MIXTO;URBANO;NO OFICIAL;47001
1,44279E+11;INSTITUCION EDUCATIVA ROIG Y VILLALBA;A;MIXTO;URBANO;OFICIAL;44279
1,47268E+11;INSTITUCION EDUCATIVA DEPARTAMENTAL EUCLIDES LIZARAZO;A;MIXTO;URBANO;OFICIAL;47268
2,20013E+11;I.E. LUIS GIRALDO;A;MIXTO;RURAL;OFICIAL;20013
2,23417E+11;IE ROMAN CHICA OLAYA;A;MIXTO;RURAL;OFICIAL;23417
3,08433E+11;CENTRO DE EDUCACION DE ADULTOS JOSE ANTONIO RICAURTE;A;MIXTO;URBANO;NO OFICIAL;8433
2,13667E+11;I.E. DE HATILLO DE LOBA;A;MIXTO;URBANO;OFICIAL;13300
3,08001E+11;COLEGIO EMILIO SOTO MAYOR;A;MIXTO;URBANO;NO OFICIAL;8001
1,25772E+11;INSTITUCION EDUCATIVA DEPARTAMENTAL GONZALO JIMENEZ DE QUESADA;A;MIXTO;URBANO;OFICIAL;25772
1,47058E+11;INSTITUCION EDUCATIVA DEPARTAMENTAL LICEO ARIGUANI;A;MIXTO;URBANO;OFICIAL;47058
1,25754E+11;INSTITUCION EDUCATIVA LA DESPENSA;A;MIXTO;URBANO;OFICIAL;25754
3,15001E+11;COLEGIO LEV VYGOTSKY;A;MIXTO;URBANO;NO OFICIAL;15001
2,47692E+11;INSTITUCION EDUCATIVA DEPARTAMENTAL RURAL SAN VALENTIN;A;MIXTO;RURAL;OFICIAL;47692
2,2357E+11;INSTITUCION EDUCATIVA CINTURA;A;MIXTO;RURAL;OFICIAL;23570
3,88001E+11;COLEGIO LUIS AMIGO;A;MIXTO;URBANO;NO OFICIAL;88001
1,68276E+11;COL GONZALO JIMENEZ NAVAS;A;MIXTO;URBANO;OFICIAL;68276
1,08758E+11;INSTITUCION EDUCATIVA TECNICO INDUSTRIAL BLAS TORRES DE LA TORRE;A;MIXTO;URBANO;OFICIAL;8001
1,08001E+11;I.E.D. JOSE RAIMUNDO SOJO;A;MIXTO;URBANO;NO OFICIAL;8001
1,13001E+11;INSTITUCION EDUCATIVA JOHN F KENNEDY;A;MIXTO;URBANO;OFICIAL;13001
1,44001E+11;JOSE ANTONIO GALAN;A;MIXTO;URBANO;OFICIAL;44001
1,23672E+11;INSTITUCION EDUCATIVA  JOSE ANTONIO GALAN;A;MIXTO;RURAL;OFICIAL;23672
1,13001E+11;INSTITUCION EDUCATIVA NUESTRA SRA DEL CARMEN;A;MIXTO;URBANO;OFICIAL;13001
1,23068E+11;IE PABLO VI;A;MIXTO;URBANO;OFICIAL;23068
2,13006E+11;I.E.T. AGROPECUARIA DE  PUERTO VENECIA;A;MIXTO;RURAL;OFICIAL;13006
1,13001E+11;INSTITUCION EDUCATIVA MARIA CANO;A;MIXTO;URBANO;OFICIAL;13001
1,44001E+11;CENTRO DE INTEGRACION POPULAR;A;MIXTO;URBANO;OFICIAL;44001
1,27001E+11;IE TECNICA INTEGRADO CARRASQUILLA INDUSTRIAL;A;MIXTO;URBANO;OFICIAL;27001
3,08759E+11;CENTRO DE EDUCACIÓN POR CICLOS SIMON BOLIVAR  CESBO;A;MIXTO;URBANO;NO OFICIAL;8758
2,47001E+11;IED DE BONDA;A;MIXTO;URBANO;OFICIAL;47001
3,13052E+11;ESC. MARIA EUGENIA VELANDIA SUAREZ;A;MIXTO;URBANO;NO OFICIAL;13052
1,13052E+11;I.E. TECNICA EN ARTES Y OFICIOS MARIA MICHELSEN DE LOPEZ;A;MIXTO;URBANO;OFICIAL;13052
1,68001E+11;I E TEC JORGE ARDILA DUARTE;A;MIXTO;URBANO;OFICIAL;68001
3,2055E+11;IE JOSE MARIA TORTI SORIANO;A;MIXTO;URBANO;OFICIAL;20550
2,05051E+11;I. E. R. MONSEÑOR ESCOBAR VELEZ;A;MIXTO;RURAL;OFICIAL;5659
1,20228E+11;I.E. SAN JOSE;A;MIXTO;URBANO;OFICIAL;20228
3,6877E+11;INSTITUTO PEDAGOGICO DE COLOMBIA INSPEDCOL;A;MIXTO;URBANO;NO OFICIAL;68770
2,44847E+11;I.E. ETNOEDUCATIVA INTERNADO INDIGENA DE KAMUSHIWOU;A;MIXTO;RURAL;OFICIAL;44847
3,05001E+11;CENT DE DESARROLLO INTEGRADO - CENDI;OTRO;MIXTO;URBANO;NO OFICIAL;5001
2,2006E+11;I.E. CARLOS RESTREPO ARAUJO;A;MIXTO;URBANO;OFICIAL;20060
1,23555E+11;INST.EDUC. LA ESPERANZA;A;MIXTO;URBANO;OFICIAL;23555
1,19137E+11;I.E. INSTITUTO EDUCATIVO DE FORMACION INTERCULTURAL COMUNITARIO KWESX UMA KIWE - INFIKUK;A;MIXTO;RURAL;OFICIAL;19137
3,4177E+11;IE SAN LORENZO;A;MIXTO;URBANO;OFICIAL;41770
1,68077E+11;INSTITUTO INTEGRADO DE COMERCIO;A;MIXTO;URBANO;OFICIAL;68077
3,20013E+11;I.E. DIVINO NIÑO;A;MIXTO;RURAL;OFICIAL;20013
1,08001E+11;INSTITUCION EDUCATIVA DISTRITAL LUIS CARLOS GALAN SARMIENTO;A;MIXTO;URBANO;OFICIAL;8001
1,08758E+11;INSTITUCION EDUCATIVA SAGRADO CORAZON;A;MIXTO;URBANO;OFICIAL;8758
1,08638E+11;INSTITUCION EDUCATIVA TECNICA INDUSTRIAL DE SABANALARGA;A;MIXTO;URBANO;OFICIAL;8638
3,47288E+11;INSTITUCION EDUCATIVA DEPARTAMENTAL COLOMBIA;A;MIXTO;URBANO;OFICIAL;47288
1,2358E+11;IE JOSE MERIA CORDOBA;A;MIXTO;URBANO;OFICIAL;23580
2,13549E+11;I.E. DE PUERTO LOPEZ;A;MIXTO;RURAL;OFICIAL;13549
3,13473E+11;I.E.T.A. VICENTE HONDARZA;A;MIXTO;URBANO;OFICIAL;13473
1,41001E+11;SANTA TERESA;A;MIXTO;URBANO;OFICIAL;41001
2,278E+11;CE INDÍGENA CUNA YALA DE ARQUIA;A;MIXTO;RURAL;OFICIAL;27800
1,47189E+11;IE SAN JUAN DEL CORDOBA;A;MIXTO;URBANO;OFICIAL;47189
2,23417E+11;INST EDUC EL CARMEN;A;MIXTO;URBANO;OFICIAL;23300
1,70418E+11;I.E. SANTA ROSA DE LIMA;A;MIXTO;URBANO;OFICIAL;70418
2,27025E+11;CE INDÍGENA FLORESMIRO DOGIRAMA;A;MIXTO;RURAL;OFICIAL;27025
3,08758E+11;CENTRO EDUCATIVO SAN BERNARDO PARA ADULTOS;A;MIXTO;URBANO;NO OFICIAL;8758
2,7067E+11;I.E. INDIGENA SAN FRANCISCO EL PAKY;A;MIXTO;RURAL;OFICIAL;70670
1,68432E+11;COLEGIO CUSTODIO GARCIA ROVIRA;A;MIXTO;URBANO;OFICIAL;68432
2,73504E+11;INSTITUCION EDUCATIVA SAMARIA;A;MIXTO;RURAL;OFICIAL;73504
2,5482E+11;I.E. INSTITUCIÓN ETNOEDUCATIVA U WA IZQUETA (SEGOVIA);A;MIXTO;RURAL;OFICIAL;54820
1,05001E+11;INST EDUC HECTOR ABAD GOMEZ;A;MIXTO;URBANO;OFICIAL;5001
2,68547E+11;INSTITUTO DE PROMOCION SOCIAL;A;MIXTO;RURAL;OFICIAL;68547
1,76109E+11;TÉCNICO INDUSTRIAL GERARDO VALENCIA CANO;A;MIXTO;URBANO;OFICIAL;76109
3,11001E+11;COLEGIO INTEGRAL;A;MIXTO;URBANO;NO OFICIAL;11001
3,25307E+11;COLEGIO DE EDUCACIÓN BÁSICA Y MEDIA ACADÉMICA PARA ADULTOS HEISEMBERG;A;MIXTO;URBANO;NO OFICIAL;25612
2,19824E+11;I.E. POLINDARA;A;MIXTO;RURAL;OFICIAL;19824
1,68082E+11;MEGACOLEGIO JUAN FRANCISCO SARASTI JARAMILLO;A;MIXTO;URBANO;OFICIAL;68081
1,13052E+11;I.E. BENJAMIN HERRERA;A;MIXTO;URBANO;OFICIAL;13052
1,76275E+11;IE LAS AMERICAS;A;MIXTO;URBANO;OFICIAL;76275
1,05001E+11;INST EDUC GILBERTO ALZATE AVENDA?O;A;MIXTO;URBANO;OFICIAL;5001
2,23001E+11;INSTITUCION EDUCATIVA CAMILO TORRES MOCARI;A;MIXTO;URBANO;OFICIAL;23001
2,23807E+11;INSTITUCION EDUCATIVA 1 DE MAYO;A;MIXTO;RURAL;OFICIAL;23807
1,08758E+11;INSTITUCION EDUCATIVA POLITECNICO DE SOLEDAD;A;FEMENINO;URBANO;OFICIAL;8758
1,23417E+11;IE ANTONIO DE LA TORRE Y MIRANDA;A;MIXTO;URBANO;OFICIAL;23417
1,08002E+11;INSTITUCION EDUCATIVA DISTRITAL VILLAS DE SAN PABLO;A;MIXTO;URBANO;OFICIAL;8001
1,47001E+11;IED EL PANDO;A;MIXTO;URBANO;OFICIAL;47001
1,08638E+11;INSTITUCION EDUCATIVA DE SABANALARGA FERNANDO HOYOS RIPOLL;A;MIXTO;URBANO;OFICIAL;8638
2,70678E+11;INST EDUC PUERTO FRANCO;A;MIXTO;RURAL;OFICIAL;70235
1,7652E+11;IE TERESA CALDERON DE LASSO;A;MIXTO;URBANO;OFICIAL;76520
2,13433E+11;INSTITUCION EDUCATIVA DE EVITAR;A;MIXTO;RURAL;OFICIAL;13433
1,08758E+11;INSTITUCION EDUCATIVA DE SOLEDAD - INOBASOL;A;MIXTO;URBANO;OFICIAL;8758
1,68081E+11;INSTITUCION EDUCATIVA  EL  CASTILLO;A;MIXTO;URBANO;OFICIAL;68081
3,13001E+11;INST. SAN ISIDRO LABRADOR;A;MIXTO;URBANO;NO OFICIAL;13001
1,08296E+11;INSTITUCION EDUCATIVA FRANCISCO DE PAULA SANTANDER;A;MIXTO;URBANO;OFICIAL;8296
1,08001E+11;INSTITUCION EDUCATIVA DISTRITAL SAN SALVADOR;A;MIXTO;URBANO;OFICIAL;8001
1,08001E+11;INSTITUCION EDUCATIVA DISTRITAL COSTA CARIBE;A;MIXTO;URBANO;OFICIAL;8001
1,76001E+11;INSTITUCION EDUCATIVA REPUBLICA DE ISRAEL;A;MIXTO;URBANO;OFICIAL;76001
1,52356E+11;INSTITUCION EDUCATIVA SUCRE;A;MIXTO;URBANO;OFICIAL;52356
1,05761E+11;I. E. JOSE MARIA VILLA;A;MIXTO;URBANO;OFICIAL;5761
1,19698E+11;INSTITUCION EDUCATIVA LIMBANIA VELASCO;A;MIXTO;URBANO;OFICIAL;19698
1,08758E+11;INSTITUCION EDUCATIVA TECNICA INDUSTRIAL SAN ANTONIO DE PADUA;A;MIXTO;URBANO;OFICIAL;8758
3,08001E+11;INSTITUCION EDUCATIVA DISTRITAL MARIE POUSSEPIN;A;FEMENINO;URBANO;OFICIAL;8001
1,11001E+11;COLEGIO JOSÉ FRANCISCO SOCARRÁS (IED);A;MIXTO;URBANO;OFICIAL;11001
1,08001E+11;INST. EDUC. DIST. PARA EL DESARROLLO DEL TALENTO HUMANO;A;MIXTO;URBANO;OFICIAL;8001
3,47058E+11;INSTITUCION EDUCATIVA DEPARTAMENTAL SIMON BOLIVAR;A;MIXTO;URBANO;OFICIAL;47058
3,41676E+11;IE SANTA JUANA DE ARCO;A;MIXTO;URBANO;OFICIAL;41676
1,68001E+11;I E SAN FRANCISCO DE ASIS;A;MIXTO;URBANO;OFICIAL;68001
2,44001E+11;LIVIO REGINALDO FISCHIONE;A;MIXTO;URBANO;OFICIAL;44001
2,7652E+11;IE SEMILLA DE LA ESPERANZA;A;MIXTO;RURAL;OFICIAL;76520
2,4443E+11;INSTITUCION EDUCATIVA SAN RAFAEL DE ALBANIA;A;MIXTO;URBANO;OFICIAL;44035
1,17001E+11;NORMAL SUP. DE CALDAS;A;MIXTO;URBANO;OFICIAL;17001
1,05001E+11;INST EDUC PROGRESAR;A;MIXTO;URBANO;OFICIAL;5001
2,47058E+11;INSTITUCION EDUCATIVA DEPARTAMENTAL TECNICA AGROPECUARIA CARMEN DE ARIGUANI;A;MIXTO;RURAL;OFICIAL;47058
1,76001E+11;INSTITUCION EDUCATIVA TECNICO INDUSTRIAL ANTONIO JOSE CAMACHO;A;MIXTO;URBANO;OFICIAL;76001
1,70265E+11;I.E. DE GUARANDA;A;MIXTO;URBANO;OFICIAL;70265
3,44847E+11;INSTITUCION EDUCATIVA INTERNADO INDIGENA SAN JOSE;A;FEMENINO;URBANO;OFICIAL;44847
3,44001E+11;INSTITUTO GARDNER;A;MIXTO;URBANO;NO OFICIAL;44001
1,11001E+11;COLEGIO HERNANDO DURAN DUSSAN (IED);A;MIXTO;URBANO;OFICIAL;11001
1,13001E+11;INSTITUCION EDUCATIVA LUIS CARLOS LOPEZ;A;MIXTO;URBANO;OFICIAL;13001
1,23001E+11;INSTITUCION EDUCATIVA CECILIA DE LLERAS;A;MIXTO;URBANO;OFICIAL;23001
3,13836E+11;COLEGIO LA NUEVA ESPERANZA;A;MIXTO;URBANO;NO OFICIAL;13001
3,08001E+11;CENTRO DE EDUCACION INTEGRAL DE LA COSTA;A;MIXTO;URBANO;NO OFICIAL;8001
2,47555E+11;INSTITUCION EDUCATIVA DEPARTAMENTAL AGROPECUARIA URBANO MOLINA CASTRO;A;MIXTO;RURAL;OFICIAL;47460
1,13001E+11;INSTITUCION EDUCATIVA JUAN JOSE NIETO;A;MIXTO;URBANO;OFICIAL;13001
1,08685E+11;INSTITUCION EDUCATIVA TECNICA AGROINDUSTRIAL ORIENTAL;A;MIXTO;URBANO;OFICIAL;8685
1,08001E+11;INSTITUCION EDUCATIVA DISTRITAL INSTITUTO TECNICO DE COMERCIO BARRANQUILLA;A;FEMENINO;URBANO;OFICIAL;8001
1,20001E+11;IE BELLO HORIZONTE;A;MIXTO;URBANO;OFICIAL;20001
1,08001E+11;CENTRO DE EDUCACION BAS. Y MEDIA # 103;A;MIXTO;URBANO;OFICIAL;8001
3,13001E+11;CIUDAD ESCOLAR DE COMFENALCO;A;MIXTO;URBANO;NO OFICIAL;13001
1,13001E+11;INSTITUCION EDUCATIVA RAFAEL NU?EZ;A;MIXTO;URBANO;OFICIAL;13001
1,13244E+11;I.E. MARIA INMACULADA;A;MIXTO;URBANO;OFICIAL;13244
1,97001E+11;I.E.I. JOSE EUSTASIO RIVERA;A;MIXTO;URBANO;OFICIAL;97001
2,08141E+11;INSTITUCION EDUCATIVA DE LEÑA;A;MIXTO;RURAL;OFICIAL;8141
1,70001E+11;INSTITUCION EDUCATIVA POLICARPA SALAVARRIETA;A;MIXTO;URBANO;OFICIAL;70001
1,05172E+11;I. E. LOS ANDES;A;MIXTO;URBANO;OFICIAL;5172
3,05088E+11;INST PREUNIVERSITARIO DE BELLOANTONIO DE J RIOS;A;MIXTO;URBANO;NO OFICIAL;5088
3,23001E+11;BACHILLERATO SEMIPRESENCIAL CANTACLARO;A;MIXTO;URBANO;NO OFICIAL;23001
1,13683E+11;I.E.T. AGROPECUARIA NUESTRA SEÑORA DEL CARMEN;A;MIXTO;URBANO;OFICIAL;13683
1,08001E+11;INSTITUCION EDUCATIVA DISTRITAL NUESTRA SEÑORA DEL ROSARIO;A;MIXTO;URBANO;OFICIAL;8001
1,41132E+11;IE EUGENIO FERRO FALLA;A;MIXTO;URBANO;OFICIAL;41132
3,08001E+11;COLEGIO DE LA COOPERATIVA DE TRABAJADORES DE AVIANCA COOPAVA;A;MIXTO;URBANO;NO OFICIAL;8001
3,08001E+11;COLEGIO NUESTRA SEÑORA DE LAS MERCEDES;A;MIXTO;URBANO;NO OFICIAL;8001
2,47001E+11;INSTITUCION ETNOEDUCATIVA DISTRITAL ZALEMAKU SERTUGA;A;MIXTO;RURAL;OFICIAL;47001
2,13074E+11;I.E. ALEJANDRO DURAN DIAZ;A;MIXTO;URBANO;OFICIAL;13030
3,47001E+11;INSTITUCION EDUCATIVA PARA EL DESARROLLO INTEGRAL IEDI;A;MIXTO;URBANO;NO OFICIAL;47001
1,2055E+11;I.E. NACIONALIZADO INTEGRADO;A;MIXTO;URBANO;OFICIAL;20550
1,20002E+11;INSTITUCION EDUCATIVA ANDRES NICOLAS ESCOBAR ESCOBAR;A;MIXTO;URBANO;OFICIAL;20001
1,2366E+11;INSTITUCION EDUCATIVA ANDRES RODRIGUEZ B.;A;MIXTO;URBANO;OFICIAL;23660
2,05045E+11;I.E.R. PEDRONEL DURANGO;A;MIXTO;RURAL;OFICIAL;5045
1,13244E+11;I.E.T.I. JUAN FEDERICO HOLLMAN;A;MIXTO;URBANO;OFICIAL;13244
1,66001E+11;IE VILLA SANTANA;A;MIXTO;URBANO;OFICIAL;66001
1,4443E+11;INSTITUCION EDUCATIVA NO. 13;A;MIXTO;URBANO;OFICIAL;44430
1,4443E+11;INSTITUCION EDUCATIVA NO. 6;A;MIXTO;URBANO;OFICIAL;44430
1,23807E+11;INSTITUCION EDUCATIVA BENICIO AGUDELO;A;MIXTO;URBANO;OFICIAL;23807
3,6617E+11;CENTRO EDUCATIVO CIENCIA;A;MIXTO;URBANO;NO OFICIAL;66170
1,47675E+11;INSTITUCION EDUCATIVA DEPARTAMENTAL DE SALAMINA;A;MIXTO;URBANO;OFICIAL;47675
1,13001E+11;INSTITUCION EDUCATIVA SOLEDAD ACOSTA DE SAMPER;A;MIXTO;URBANO;OFICIAL;13001
3,11001E+11;COL SAN FELIPE NERI;A;MIXTO;URBANO;NO OFICIAL;11001
3,23001E+11;INSTITUCION EDUCATIVA COMFACOR JAIME EXBRAYAT;A;MIXTO;URBANO;NO OFICIAL;23001
2,66001E+11;IE GABRIEL TRUJILLO;A;MIXTO;RURAL;OFICIAL;66001
3,08758E+11;CENTRO DE EDUCACION PARA ADULTOS GIMNASIO DEL CARIBE;A;MIXTO;URBANO;NO OFICIAL;8758
2,41006E+11;IE SAN MARCOS;A;MIXTO;RURAL;OFICIAL;41006
3,47001E+11;CORPORACION EDUCATIVA DEL CARIBE - CEDELCA;A;MIXTO;URBANO;NO OFICIAL;47001
1,88001E+11;INSTITUCION EDUCATIVA TECNICO INDUSTRIAL;A;MIXTO;URBANO;OFICIAL;88001
1,5481E+11;COL INTEG FRANCISCO JOSE DE CALDAS;A;MIXTO;URBANO;OFICIAL;54810
1,8543E+11;INST TEC INTEGRADO DE TRINIDAD;A;MIXTO;URBANO;OFICIAL;85430
1,68081E+11;INSTITUCION EDUCATIVA INSTITUTO TECNICO SUPERIOR DE COMERCIO;A;MIXTO;URBANO;OFICIAL;68081
2,70429E+11;I.E. LAS PALMITAS;A;MIXTO;RURAL;OFICIAL;70429
2,19548E+11;INSTITUCION EDUCATIVA AGROINDUSTRIAL LA MARIA;A;MIXTO;RURAL;OFICIAL;19548
1,86568E+11;IE ALVERNIA;A;MIXTO;URBANO;OFICIAL;86568
1,68547E+11;COLEGIO HUMBERTO GOMEZ NIGRINIS;A;MIXTO;URBANO;OFICIAL;68547
1,50001E+11;COLEGIO CHAMPAGNAT PINARES DE ORIENTE;A;MIXTO;URBANO;OFICIAL;50001
2,0525E+11;I. E. R. PUERTO CLAVER;A;MIXTO;RURAL;OFICIAL;5250
1,11001E+11;COLEGIO EL MINUTO DE  BUENOS AIRES (IED);A;MIXTO;URBANO;OFICIAL;11001
1,2529E+11;INSTITUCION EDUCATIVA MUNICIPAL INST. TECNICO INDUSTRIAL;A;MIXTO;URBANO;OFICIAL;25290
3,76834E+11;ACADEMIA ACADEMIA SAM;A;MIXTO;URBANO;NO OFICIAL;76834
3,4443E+11;LICEO COMERCIAL DEL CARIBE;A;MIXTO;URBANO;NO OFICIAL;44430
2,19821E+11;INSTITUCION EDUCATIVA LAPRIMICIA;A;MIXTO;RURAL;OFICIAL;19821
1,13657E+11;I.E. ACADEMICA Y TECNICA EN GESTION EMPRESARIAL DIOGENES A. ARRIETA;A;MIXTO;URBANO;OFICIAL;13657
2,4443E+11;INSTITUCION EDUCATIVA NO. 7;A;MIXTO;URBANO;OFICIAL;44430
1,11001E+11;COLEGIO JUAN REY (IED);A;MIXTO;URBANO;OFICIAL;11001
1,54001E+11;COL GREMIOS UNIDOS;A;MIXTO;URBANO;OFICIAL;54001
2,99001E+11;I.E. INTERNADO SAN BARTOLOME;A;MIXTO;RURAL;OFICIAL;99624
2,23001E+11;INSTITUCION EDUCATIVA BUENOS AIRES;A;MIXTO;RURAL;OFICIAL;23001
1,08001E+11;INST. EDUC. DIST. PINAR DEL RIO (ANT. C.E.B. # 146);A;MIXTO;URBANO;OFICIAL;8001
1,25758E+11;INSTITUCION EDUCATIVA COMPLEJO EDUCATIVO INTEGRAL SOPO;A;MIXTO;URBANO;OFICIAL;25758
3,54001E+11;I.E. PARA JÓVENES Y ADULTOS SIN FRONTERAS;A;MIXTO;URBANO;NO OFICIAL;54001
1,83592E+11;I.E ACEVEDO Y GOMEZ;A;MIXTO;URBANO;OFICIAL;18592
1,19824E+11;INSTITUCION EDUCATIVA FRANCISCO JOSE DE CALDAS;A;MIXTO;URBANO;OFICIAL;19824
1,68406E+11;COLEGIO INTEGRADO NUESTRA SE¿ORA DE LAS MERCEDES;A;MIXTO;URBANO;OFICIAL;68406
1,68755E+11;COLEGIO UNIVERSITARIO;A;MIXTO;URBANO;OFICIAL;68755
2,88564E+11;I.E. JUNIN;A;MIXTO;RURAL;OFICIAL;88564
4,41799E+11;IE NICOLAS GARCIA BAHAMON;A;MIXTO;RURAL;OFICIAL;41799
1,08634E+11;INSTITUCION EDUCATIVA ESCUELA NORMAL SUPERIOR NUESTRA SE¿ORA DE FATIMA;A;FEMENINO;URBANO;OFICIAL;8634
2,19455E+11;INSTITUCION EDUCATIVA EL CABILDO (ANTES CENTRO EDUCATIVO EL CABILDO);A;MIXTO;RURAL;OFICIAL;19455
1,08758E+11;I.E. BICENTENARIO DE SOLEDAD;A;MIXTO;URBANO;NO OFICIAL;8758
1,08296E+11;INSTITUCION EDUCATIVA MARIA AUXILIADORA;A;MIXTO;URBANO;OFICIAL;8296
2,1344E+11;I.E. DE MAMONCITO;A;MIXTO;RURAL;OFICIAL;13440
1,23001E+11;INSTITUCION  EDUCATIVA SAN JOSE;A;MIXTO;URBANO;OFICIAL;23001
2,54385E+11;INST EDUCATIVA JESUS ANTONIO RAMIREZ;A;MIXTO;RURAL;OFICIAL;54385
1,08001E+11;INSTITUCION EDUCATIVA COLEGIO DISTRITAL MARIA AUXILIADORA;A;MIXTO;URBANO;OFICIAL;8001
2,27001E+11;IE ANTONIO RICAURTE;A;MIXTO;URBANO;OFICIAL;27001
1,73624E+11;INSTITUCION EDUCATIVA FRANCISCO DE MIRANDA;A;MIXTO;URBANO;OFICIAL;73624
3,13001E+11;COL.  MONTESSORI;A;MIXTO;URBANO;NO OFICIAL;13001
1,52835E+11;IE. CIUDADELA MIXTA COLOMBIA;A;MIXTO;URBANO;OFICIAL;52835
3,20001E+11;COL. GIMNASIO DEL NORTE;A;MIXTO;URBANO;NO OFICIAL;20001
1,08001E+11;INSTITUCION EDUCATIVA DISTRITAL LA ESMERALDA;A;MIXTO;URBANO;OFICIAL;8001
3,23466E+11;FUND EDUC DE MONTELIBANO;A;MIXTO;URBANO;NO OFICIAL;23466
3,76001E+11;COLEGIO TECNICO JUVENIL DEL SUR;A;MIXTO;URBANO;NO OFICIAL;76001
3,1343E+11;INST TEC CULT DIOCESANO;A;MIXTO;URBANO;NO OFICIAL;13430
2,1343E+11;I.E. DE COYONGAL;A;MIXTO;RURAL;OFICIAL;13430
3,08758E+11;LICEO MIGUEL DE CERVANTES SAAVEDRA DE SOLEDAD;A;MIXTO;URBANO;NO OFICIAL;8758
3,08001E+11;INSTITUCION EDUCATIVA DISTRITAL TECNICA PABLO NERUDA;A;MIXTO;URBANO;OFICIAL;8001
1,47555E+11;INSTITUCION EDUCATIVA DEPARTAMENTAL JUANA ARIAS DE BENAVIDES;A;MIXTO;URBANO;OFICIAL;47555
3,47001E+11;COL FCO DE SAN LUIS BELTRAN;A;MIXTO;URBANO;NO OFICIAL;47001
3,08759E+11;CENTRO EDUCATIVO PARA ADULTOS GEORGE WASHINGTON;A;MIXTO;URBANO;NO OFICIAL;8758
1,08758E+11;INSTITUCION EDUCATIVA TECNICA FRANCISCO DE PAULA SANTANDER;A;MIXTO;URBANO;OFICIAL;8758
3,13001E+11;COLEGIO FERNANDO DE ARAGON DE CARTAGENA;A;MIXTO;URBANO;NO OFICIAL;13001
1,68547E+11;COLEGIO VICTOR FELIX GOMEZ NOVA;A;MIXTO;URBANO;OFICIAL;68547
3,25754E+11;INSTITUTO COL TECNISISTEMAS;A;MIXTO;URBANO;NO OFICIAL;25754
1,47288E+11;INSTITUCION EDUCATIVA DEPARTAMENTAL TERCERA MIXTA;A;MIXTO;URBANO;OFICIAL;47288
3,13001E+11;COLEGIO ANTARES DE CARTAGENA (JAR.INF DISNEYL.);A;MIXTO;URBANO;NO OFICIAL;13001
3,08638E+11;CENTRO DE EDUCACION BILINGUE Y PERSONALIZADA HOWARD GARDNER;A;MIXTO;URBANO;NO OFICIAL;8638
1,13001E+11;INSTITUCION EDUCATIVA FRANCISCO DE PAULA SANTANDER;A;MIXTO;URBANO;OFICIAL;13001
1,4443E+11;INSTITUCION EDUCATIVA NO. 2;A;MIXTO;URBANO;OFICIAL;44430
1,08001E+11;CIUDADELA EDUCATIVA Y CULTURAL OLGA EMILIANI;A;MIXTO;URBANO;NO OFICIAL;8001
2,05615E+11;I. E. ANA GOMEZ DE SIERRA;A;MIXTO;RURAL;OFICIAL;5615
1,11001E+11;COLEGIO DARIO ECHANDIA (IED);A;MIXTO;URBANO;OFICIAL;11001
1,13001E+11;INSTITUCION EDUCATIVA DE TERNERA;A;MIXTO;URBANO;OFICIAL;13001
1,13244E+11;I.E. ESPIRITU SANTO;A;MIXTO;URBANO;OFICIAL;13244
