codigo;nombre_colegio;calendario;genero;localización;naturaleza;codigo_m_municipio
3,11001E+11;COL JORDAN DE SAJONIA;A;MIXTO;URBANO;NO OFICIAL;11001
3,11001E+11;LIC DE OXFORD;A;MIXTO;URBANO;NO OFICIAL;11001
3,11001E+11;CENTRO EDUCATIVO LOMBARDIA;A;MIXTO;URBANO;NO OFICIAL;11001
3,11769E+11;COL ALAFAS DEL NORTE;A;MIXTO;URBANO;NO OFICIAL;11001
3,2529E+11;INST SANTANDER;A;MIXTO;URBANO;NO OFICIAL;25290
3,11001E+11;LIC AVENIDA LAS AMERICAS;A;MIXTO;URBANO;NO OFICIAL;11001
3,20001E+11;LICEO CRISTIANO LA PAZ;A;MIXTO;URBANO;NO OFICIAL;20001
2,47551E+11;INSTITUCION EDUCATIVA DEPARTAMENTAL RURAL SAN MARTIN DE LOBA;A;MIXTO;RURAL;OFICIAL;47551
1,94001E+11;I.E. LA PRIMAVERA;A;MIXTO;URBANO;OFICIAL;94001
2,2529E+11;INSTITUCION EDUCATIVA MUNICIPAL GUAVIO BAJO;A;MIXTO;RURAL;OFICIAL;25290
3,25754E+11;COLEGIO CRISTIANO SEMIDA;A;MIXTO;URBANO;NO OFICIAL;25754
1,11001E+11;COL SALESIANO JUAN DEL RIZZO;A;MASCULINO;URBANO;NO OFICIAL;11001
1,17433E+11;INSTITUCION EDUCATIVA NUESTRA SEÑORA DEL ROSARIO;A;MIXTO;URBANO;OFICIAL;17433
2,278E+11;IE SANTA MARIA LA NUEVA DEL DARIEN;A;MIXTO;RURAL;OFICIAL;27800
3,11001E+11;POLITECNICO LA SALLE;A;MIXTO;URBANO;NO OFICIAL;11001
2,41359E+11;IE MORTI¿O;A;MIXTO;RURAL;OFICIAL;41359
1,11001E+11;COLEGIO JOSE JOAQUIN CASTRO MARTINEZ (IED);A;MIXTO;URBANO;OFICIAL;11001
3,11001E+11;GIMN FELIX (GIMN SABER DEL NILO);A;MIXTO;URBANO;NO OFICIAL;11001
1,19001E+11;JOHN F KENNEDY;A;MIXTO;URBANO;OFICIAL;19001
1,52683E+11;INSTITUCION EDUCATIVA NUESTRA SEÑORA DE FATIMA;A;MIXTO;URBANO;OFICIAL;52683
2,47161E+11;INSTITUCION EDUCATIVA DEPARTAMENTAL DE BASICA Y MEDIA DE CONCORDIA;A;MIXTO;URBANO;OFICIAL;47205
2,17444E+11;INSTITUCION EDUCATIVA ANTONIO MARIA HINCAPIE;A;MIXTO;RURAL;OFICIAL;17444
1,2766E+11;IE SAN JOSE;A;MIXTO;URBANO;OFICIAL;27660
1,54001E+11;COL ORIENTAL NO 26;A;MIXTO;URBANO;OFICIAL;54001
2,73026E+11;INSTITUCION EDUCATIVA LUIS CARLOS GALAN SARMIENTO;A;MIXTO;RURAL;OFICIAL;73026
3,54498E+11;CORPORACION PEDAGOGICA COLOMBIANA;A;MIXTO;URBANO;NO OFICIAL;54498
3,68081E+11;COL MIGUEL ANTONIO CARO;A;MIXTO;URBANO;NO OFICIAL;68081
3,11001E+11;CENT EDUC PROEDUCAR;A;MIXTO;URBANO;NO OFICIAL;11001
1,11001E+11;COLEGIO ALVARO GOMEZ HURTADO (IED);A;MIXTO;URBANO;OFICIAL;11001
1,11001E+11;COLEGIO JOSE ACEVEDO Y GOMEZ (IED);A;MIXTO;URBANO;OFICIAL;11001
3,05837E+11;COL. DIOCESANO NUESTRA SENORA DEL CARMEN;A;MIXTO;URBANO;NO OFICIAL;5837
3,25286E+11;COLEGIO INCADE;A;MIXTO;URBANO;NO OFICIAL;25286
3,54001E+11;COL PADRE LUIS VARIARA;A;MIXTO;URBANO;NO OFICIAL;54001
1,11001E+11;COLEGIO SAN BENITO ABAD (IED);A;MIXTO;URBANO;OFICIAL;11001
1,11001E+11;COLEGIO LAS MERCEDES (IED);A;MIXTO;URBANO;OFICIAL;11001
3,76001E+11;COLEGIO CESAR CONTO;A;MIXTO;URBANO;NO OFICIAL;76001
1,11001E+11;COLEGIO GIMNASIO SABIO CALDAS (IED);A;MIXTO;URBANO;OFICIAL;11001
1,05001E+11;INST EDUC ANGELA RESTREPO MORENO;A;MIXTO;URBANO;OFICIAL;5001
2,17662E+11;INSTITUCION EDUCATIVA RANCHO LARGO;A;MIXTO;RURAL;OFICIAL;17662
3,11001E+11;LIC NORMANDIA;A;MIXTO;URBANO;NO OFICIAL;11001
2,191E+11;INST EDUC ANDINO SAN LORENZO;A;MIXTO;RURAL;OFICIAL;19100
3,11001E+11;INST EL INGENIOSO HIDALGO;A;MIXTO;URBANO;NO OFICIAL;11001
1,44874E+11;I. E. TÉCNICA PROMOCION SOCIAL;A;MIXTO;URBANO;OFICIAL;44874
2,19532E+11;I.E. DE DESARROLLO RURAL EL ESTRECHO;A;MIXTO;RURAL;OFICIAL;19532
4,25377E+11;COLEGIO EL GRAN CASTILLO Y PELDAÑOS;A;MIXTO;URBANO;NO OFICIAL;25377
1,25281E+11;INSTITUCION EDUCATIVA DEPARTAMENTAL DE DESARROLLO RURAL;A;MIXTO;RURAL;OFICIAL;25281
3,11001E+11;COL CIUDAD DE CALI;A;MIXTO;URBANO;NO OFICIAL;11001
3,25754E+11;CENTRO DE CAPACITACIÓN BOLÍVAR CENCABO;A;MIXTO;URBANO;NO OFICIAL;25754
1,15696E+11;I.E. TECNICO AGROPECUARIO;A;MIXTO;URBANO;OFICIAL;15696
3,4443E+11;INST. PEDAGOGICO DE MAICAO;A;MIXTO;URBANO;NO OFICIAL;44430
2,76001E+11;INSTITUCION EDUCATIVA LA PAZ;A;MIXTO;RURAL;OFICIAL;76001
1,5232E+11;INSTITUCION EDUCATIVA TECNICA MARIA AUXILIADORA;A;MIXTO;URBANO;OFICIAL;52320
3,08001E+11;COLEGIO DEL SAGRADO CORAZON;A;MIXTO;URBANO;NO OFICIAL;8001
4,25843E+11;COL COOP SAN FRANCISCO DE ASIS;A;MIXTO;RURAL;NO OFICIAL;25843
3,25307E+11;INSTITUTO POLITECNICO NACIONAL LATINOAMERICANO;A;MIXTO;URBANO;NO OFICIAL;25295
3,15646E+11;COL SAGRADO CORAZON DE JESUS;A;MIXTO;URBANO;NO OFICIAL;15646
3,20011E+11;LICEO HUMANISTA DE AGUACHICA;A;MIXTO;URBANO;NO OFICIAL;20011
2,47318E+11;INSTITUCION EDUCATIVA DEPARTAMENTAL DE RICAURTE;A;MIXTO;RURAL;OFICIAL;47318
1,664E+11;IE ALFONSO LOPEZ PUMAREJO;A;MIXTO;URBANO;OFICIAL;66400
2,25269E+11;I.E.M MANABLANCA;A;MIXTO;URBANO;OFICIAL;25269
3,50001E+11;LICEO CRISTIANO LOS ANDES;A;MIXTO;URBANO;NO OFICIAL;50001
3,15776E+11;IE HECTOR JULIO GOMEZ;A;MIXTO;URBANO;OFICIAL;15776
3,11001E+11;COL ISIDRO MOLINA;A;MIXTO;URBANO;NO OFICIAL;11001
2,70429E+11;I.E. SAN JUAN BAUTISTA DE PUEBLO NUEVO;A;MIXTO;RURAL;OFICIAL;70429
3,05266E+11;COL FONTAN;A;MIXTO;URBANO;NO OFICIAL;5001
3,11001E+11;COL JULIA LOPEZ MARTINEZ;A;MIXTO;URBANO;NO OFICIAL;11001
3,11764E+11;LICEO RIOBAMBA;A;MIXTO;URBANO;NO OFICIAL;11001
4,70823E+11;I.E. LA  INMACULADA CONCEPCION;A;MIXTO;RURAL;OFICIAL;70823
1,23466E+11;INST. EDC. ALIANZA PARA EL PROGRESO;A;MIXTO;URBANO;OFICIAL;23466
3,11001E+11;INST CEMODEN;A;MIXTO;URBANO;NO OFICIAL;11001
3,08001E+11;FUNDACION COLEGIO CRISTIANO EL SALVADOR;A;MIXTO;URBANO;NO OFICIAL;8001
3,54874E+11;COL MIXTO SANTISIMA TRINIDAD;A;MIXTO;URBANO;NO OFICIAL;54874
3,08001E+11;BACHILLERATO TEC AUTODIRIGIDO;A;MIXTO;URBANO;NO OFICIAL;8001
3,11001E+11;COL CIAL VILLA MARIA;A;MIXTO;URBANO;NO OFICIAL;11001
4,23466E+11;LICEO ALTOS DEL LIBANO;A;MIXTO;URBANO;NO OFICIAL;23466
2,08436E+11;INSTITUCION EDUCATIVA AGROPISCICOLA DE LAS COMPUERTAS;A;MIXTO;RURAL;OFICIAL;8436
2,23001E+11;INSTITUCION EDUCATIVA BESITO BOLAO;A;MIXTO;RURAL;OFICIAL;23001
2,15542E+11;IE EL HATO;A;MIXTO;RURAL;OFICIAL;15542
3,6617E+11;CEIM DOSQUEBRADAS S.A.S;A;MIXTO;URBANO;NO OFICIAL;66170
3,68001E+11;COL BILINGUE DIVINO NIÑO;A;MIXTO;URBANO;NO OFICIAL;68001
3,11001E+11;INST CIAL EDUARDO TORRES QUINTERO;A;MIXTO;URBANO;NO OFICIAL;11001
1,66001E+11;IE FRANCISCO DE PAULA SANTANDER;A;MIXTO;URBANO;OFICIAL;66001
3,15759E+11;LICEO DE LA PRESENTACION;A;MIXTO;URBANO;NO OFICIAL;15806
3,05001E+11;COLEGIO JOSE MARIA BERRIO;A;MASCULINO;RURAL;NO OFICIAL;5631
3,11001E+11;FUNDACIÓN SABIDURÍA UNIVERSAL REGINISTA SAUR;A;MIXTO;URBANO;NO OFICIAL;11001
2,20013E+11;I. E. SAN RAMON;A;MIXTO;RURAL;OFICIAL;20013
3,15001E+11;GIMNASIO GALILEO GALILEI;A;MIXTO;URBANO;NO OFICIAL;15104
3,17002E+11;CENSA;A;MIXTO;URBANO;NO OFICIAL;17001
3,76001E+11;COLEGIO ANDINO;B;MIXTO;URBANO;NO OFICIAL;76001
3,63001E+11;CAMPESTRE EDELMIRA NIETO;A;MIXTO;URBANO;NO OFICIAL;63001
2,68255E+11;INSTITUCION EDUCATIVA  SAN PEDRO DE LA TIGRA;A;MIXTO;RURAL;OFICIAL;68255
2,52786E+11;INSTITUCION EDUCATIVA AGROPECUARIA EL REMOLINO;A;MIXTO;RURAL;OFICIAL;52786
2,20787E+11;I.E. SITIO NUEVO;A;MIXTO;RURAL;OFICIAL;20787
1,73349E+11;INSTITUCION EDUCATIVA ANTONIO HERRAN ZALDUA;A;MIXTO;URBANO;OFICIAL;73349
3,11001E+11;INST CULT CIUDAD KENNEDY;A;MIXTO;URBANO;NO OFICIAL;11001
3,4443E+11;CENTRO PARA EL DLLO DEL POT. HUMANO;A;MIXTO;URBANO;NO OFICIAL;44430
3,73001E+11;COL  ADVENTISTA DE IBAGUE;A;MIXTO;URBANO;NO OFICIAL;73001
3,11001E+11;INST STUDIUM;A;MIXTO;URBANO;NO OFICIAL;11001
3,20002E+11;COL MILITAR  MANUEL MURILLO TORO;A;MIXTO;URBANO;NO OFICIAL;20001
2,4757E+11;INSTITUCION EDUCATIVA DEPARTAMENTAL RURAL DE PALMIRA;A;MIXTO;RURAL;OFICIAL;47570
3,25754E+11;COLEGIO DE LA INMACULADA CONCEPCION;A;MIXTO;URBANO;NO OFICIAL;25754
2,47703E+11;INSTITUCION EDUCATIVA DEPARTAMENTAL JOSE DE LA LUZ MARTINEZ;A;MIXTO;RURAL;OFICIAL;47703
4,15765E+11;COLEGIO MILITAR CORONEL JUAN JOSE RONDON;A;MIXTO;RURAL;NO OFICIAL;15001
3,13001E+11;INSTITUCION EDUC COMUNITARIA LIRIO DE LOS VALLES;A;MIXTO;URBANO;NO OFICIAL;13001
1,68547E+11;COLEGIO    CABECERA DEL LLANO;A;MIXTO;URBANO;OFICIAL;68547
1,66001E+11;IE ESCUELA DE LA PALABRA;A;MIXTO;URBANO;OFICIAL;66001
2,05895E+11;I.E.R. LA PAJUILA;A;MIXTO;RURAL;OFICIAL;5895
3,05001E+11;COLEGIO EUSKADI;A;MIXTO;RURAL;NO OFICIAL;5001
3,08001E+11;COLEGIO JERUSALEM;A;MIXTO;URBANO;NO OFICIAL;8001
3,08758E+11;INSTITUCION EDUCATIVA TECNICA LOS COLOMBIANOS;A;MIXTO;URBANO;NO OFICIAL;8758
3,54001E+11;INST PEDAG CARLOS RAMIREZ PARIS;A;MIXTO;URBANO;NO OFICIAL;54001
3,25269E+11;COLEGIO SEMINARIO SAN JUAN APOSTOL;A;MASCULINO;URBANO;NO OFICIAL;25269
3,54001E+11;COL EDUC FORMAL POR CICLOS ADULTOS COLOMBO BRITANICO;A;MIXTO;URBANO;NO OFICIAL;54001
2,68872E+11;COLEGIO NUESTRA SEÑORA DE FATIMA;A;MIXTO;RURAL;OFICIAL;68370
2,70429E+11;I.E.T. AGRO DE TOMALA;A;MIXTO;RURAL;OFICIAL;70771
1,0567E+11;I. E. PRESBITERO ABRAHAN JARAMILLO;A;MIXTO;URBANO;OFICIAL;5670
3,11001E+11;COL REMBRANDT;A;MIXTO;URBANO;NO OFICIAL;11001
2,2574E+11;INSTITUCION EDUCATIVA DEPARTAMENTAL SAN MIGUEL;A;MIXTO;RURAL;OFICIAL;25740
3,25754E+11;LICEO LOS ANGELES;A;MIXTO;URBANO;NO OFICIAL;25754
3,25377E+11;INST PEDAGOGICO CAMPESTRE;A;MIXTO;URBANO;NO OFICIAL;25377
3,11001E+11;COLEGIO CIES;A;MIXTO;URBANO;NO OFICIAL;11001
3,15001E+11;COLEGIO GARCIA LORCA;A;MIXTO;URBANO;NO OFICIAL;15001
3,68547E+11;COLEGIO JOSE IGNACIO ZABALA;A;MIXTO;URBANO;NO OFICIAL;68547
2,156E+11;I.E. NUESTRA SEÑORA DE LA CANDELARIA;A;MIXTO;RURAL;OFICIAL;15600
2,15491E+11;I.E.T. DE NAZARETH;A;MIXTO;RURAL;OFICIAL;15491
3,11002E+11;GIMNASIO PSICOPEDAGOGICO INTEGRAL GIMSIPEI;A;MIXTO;URBANO;NO OFICIAL;15407
3,52001E+11;COL ESTUDIAR AULA SIN FRONTERAS;B;MIXTO;URBANO;NO OFICIAL;52001
2,68773E+11;COLEGIO GRAN MARISCAL DE AYACUCHO;A;MIXTO;RURAL;OFICIAL;68773
1,54001E+11;COL LOS SANTOS APOSTOLES;A;MIXTO;URBANO;OFICIAL;54001
2,1185E+11;COLEGIO EL DESTINO (IED);A;MIXTO;RURAL;OFICIAL;11001
2,68547E+11;INSTITUCION EDUCATIVA SAN FRANCISCO;A;MIXTO;RURAL;OFICIAL;68547
3,25473E+11;INSTITUTO PEDAGÓGICO NUESTRA SEÑORA DEL PILAR;A;MIXTO;URBANO;NO OFICIAL;25473
1,6878E+11;COLEGIO INTEGRADO CAMACHO CARRE¿O;A;MIXTO;URBANO;OFICIAL;68780
3,73268E+11;COL  MARIA MONTESSORI;A;MIXTO;URBANO;NO OFICIAL;73268
3,11001E+11;LIC NAVARRA;A;MIXTO;URBANO;NO OFICIAL;11001
3,23001E+11;COL LATINO;A;MIXTO;URBANO;NO OFICIAL;23001
3,25269E+11;ESC DE DIRECCION ACADEMICA;A;MIXTO;URBANO;NO OFICIAL;25269
3,11001E+11;COLEGIO BOSTON (ANTIGUO COL EDUC SAN MATEO);A;MIXTO;URBANO;NO OFICIAL;11001
3,11001E+11;GIMN ISRAEL;A;MIXTO;URBANO;NO OFICIAL;11001
3,25307E+11;COL LA FRATERNIDAD;A;MIXTO;URBANO;NO OFICIAL;25307
1,11001E+11;COLEGIO SANTA MARTHA  (IED);A;MIXTO;URBANO;OFICIAL;11001
3,08638E+11;INSTITUCION EDUCATIVA MADRE INMACULADA;A;FEMENINO;URBANO;NO OFICIAL;8638
3,25269E+11;NUEVO COL GARCIA  DE LORENZO;A;MIXTO;URBANO;NO OFICIAL;25269
1,63111E+11;INST BUENAVISTA;A;MIXTO;URBANO;OFICIAL;63111
2,25885E+11;INST EDUCATIVA DEPTAL URIEL MURCIA;A;MIXTO;RURAL;OFICIAL;25885
1,11001E+11;COLEGIO SAN JOSE SUR ORIENTAL (IED);A;MIXTO;URBANO;OFICIAL;11001
3,11001E+11;INST TOMAS DE IRIARTE;A;MIXTO;URBANO;NO OFICIAL;11001
3,08001E+11;COLEGIO ANTONIA SANTOS;A;MIXTO;URBANO;NO OFICIAL;8001
3,7082E+11;INST PEDAGOGICO LOS ANGELES;A;MIXTO;URBANO;NO OFICIAL;70820
4,11001E+11;LIC MARANATA;A;MIXTO;URBANO;NO OFICIAL;11001
3,1738E+11;INSTITUTO NUEVO MUNDO;A;MIXTO;URBANO;NO OFICIAL;17380
1,19001E+11;NUESTRA SEÑORA DE FATIMA;A;MIXTO;URBANO;OFICIAL;19001
3,76109E+11;I.E. EL MODELO;A;MIXTO;URBANO;NO OFICIAL;76109
1,11001E+11;INSTITUCION EDUCATIVA DISTRITAL COLOMBIA VIVA;A;MIXTO;URBANO;OFICIAL;11001
1,05266E+11;INSTITUCION EDUCATIVA JOSE MIGUEL DE LA CALLE;A;MIXTO;URBANO;OFICIAL;5266
2,63594E+11;NARANJAL;A;MIXTO;RURAL;OFICIAL;63594
3,11001E+11;LICEO EMMANUELE MARLUI;A;MIXTO;URBANO;NO OFICIAL;11001
2,6819E+11;INSTITUCIÓN EDUCATIVA  LA VERDE;A;MIXTO;RURAL;OFICIAL;68190
3,68081E+11;CECOVE;A;MIXTO;URBANO;NO OFICIAL;68081
2,20001E+11;I.E. GUATAPURI DE PROMOCIÓN SOCIAL DE GUATAPURÍ - CHEMESQUEMENA;A;MIXTO;RURAL;OFICIAL;20001
3,05001E+11;COL SAPIENCIA;A;MIXTO;URBANO;NO OFICIAL;5001
2,17042E+11;INSTITUCION EDUCATIVA JUAN XXIII;A;MIXTO;RURAL;OFICIAL;17042
2,05674E+11;I. E.  RURAL CHAPARRAL;A;MIXTO;RURAL;OFICIAL;5674
3,11001E+11;COLEGIO ERNESTO GUHL;A;MIXTO;URBANO;NO OFICIAL;11001
2,05347E+11;I. E. R. HECTOR HIGINIO BEDOYA VARGAS;A;MIXTO;RURAL;OFICIAL;5347
3,05001E+11;I.E. GUADALUPANO LA SALLE;A;MIXTO;URBANO;NO OFICIAL;5001
1,25372E+11;INSTITUCION EDUCTIVA DEPARTAMENTAL ESCUELA NORMAL SUPERIOR JUNIN;A;MIXTO;URBANO;OFICIAL;25372
3,44002E+11;SYSTEM CENTER COLOMBIA S.A.S.;A;MIXTO;URBANO;NO OFICIAL;44001
2,47707E+11;INSTITUCION EDUCATIVA DEPARTAMENTAL AGROPECUARIA NUESTRA SE¿ORA DEL CARMEN;A;MIXTO;RURAL;OFICIAL;47720
3,81794E+11;LICEO ADVENTISTA LIBERTAD;A;MIXTO;URBANO;NO OFICIAL;81794
3,68077E+11;INSTITUTO ANDINO;A;MIXTO;URBANO;NO OFICIAL;68077
1,11002E+11;COLEGIO FILARMONICO JORGE MARIO BERGOGLIO (IED);A;MIXTO;URBANO;OFICIAL;11001
3,73449E+11;CENTRO JOHANN KEPLER;A;MIXTO;URBANO;NO OFICIAL;73449
3,70001E+11;INSTITUCION EDUCATIVA PEDAGOGICO VENECIA;A;MIXTO;URBANO;NO OFICIAL;70001
3,11769E+11;GIMN LA CAMPIÑA;A;MIXTO;URBANO;NO OFICIAL;11001
3,76834E+11;INSTITUTO RAFAEL POMBO;A;MIXTO;URBANO;NO OFICIAL;76823
3,11769E+11;COL AGUSTINIANO NORTE;A;MIXTO;URBANO;NO OFICIAL;11001
1,23182E+11;IE LAS MERCEDES;A;MIXTO;URBANO;OFICIAL;23182
3,73001E+11;COLEGIO LOS ANDES DE IBAGUE;A;MIXTO;URBANO;NO OFICIAL;73001
3,52002E+11;INSTITUTO GRAN COLOMBIANO JOSE MUTIS;A;MIXTO;URBANO;NO OFICIAL;52001
1,41001E+11;CLARETIANO GUSTAVO TORRES PARRA;A;MIXTO;URBANO;OFICIAL;41001
3,11001E+11;GIMN SAN JOSE DE BAVARIA;A;MIXTO;URBANO;NO OFICIAL;11001
3,05664E+11;INSTITUTO CORFERRINI;A;MIXTO;URBANO;NO OFICIAL;5664
3,76109E+11;CENTRO EDUCATIVO SANTA ROSA;A;MIXTO;URBANO;NO OFICIAL;76109
2,25307E+11;I.E. TECNICA FRANCISCO MANZANERA HENRIQUEZ;A;MIXTO;URBANO;OFICIAL;25307
1,68001E+11;IE PROMOCION SOCIAL DEL NORTE;A;MIXTO;URBANO;OFICIAL;68001
1,25126E+11;INSTITUCION EDUCATIVA DEPARTAMENTAL POMPILIO MARTINEZ;A;MIXTO;URBANO;OFICIAL;25126
3,08001E+11;CENT.EDUC.ARQUIDIOCESANO SAN PEDRO APOSTOL;A;MIXTO;URBANO;NO OFICIAL;8001
3,15001E+11;COL MODERNO LA FLORIDA;A;MIXTO;URBANO;NO OFICIAL;15001
3,25269E+11;COLEGIO EL MUNDO JOVEN;A;MIXTO;URBANO;NO OFICIAL;25269
2,05145E+11;I. E. R. ALEGRIAS;A;MIXTO;RURAL;OFICIAL;5145
3,11001E+11;INST GUSTAVO ADOLFO BECQUER;A;MIXTO;URBANO;NO OFICIAL;11001
1,15097E+11;I.E. TECNICA Y ACADEMICA NUESTRA SEÑORA DEL ROSARIO;A;MIXTO;URBANO;OFICIAL;15097
1,66594E+11;IE NUESTRA SEÑORA DE LOS DOLORES;A;MIXTO;URBANO;OFICIAL;66594
1,63001E+11;LAS COLINAS;A;MIXTO;URBANO;OFICIAL;63001
3,13002E+11;CORPORACION EDUCATIVA JOSEPH WILSON SWAN;A;MIXTO;URBANO;NO OFICIAL;13001
4,50001E+11;INSTITUCION EDUCATIVA COLEGIO GUILLERMO CANO ISAZA;A;MIXTO;RURAL;OFICIAL;50001
3,25514E+11;INSTITUTO DE CAPACITACIÓN PARA EL TRABAJO I.C.T.;A;MIXTO;URBANO;NO OFICIAL;11001
3,8544E+11;INCETEC INSTITUTO CENTRALIZADO DE ESTUDIOS TECNICOS;A;MIXTO;URBANO;NO OFICIAL;85440
1,1185E+11;LIC DEL EJERCITO PATRIA SECTOR SUR C (SANTA BARBARA);A;MIXTO;RURAL;NO OFICIAL;11001
1,52323E+11;INSTITUCION EDUCATIVA TECNICA PROMOCION SOCIAL;A;MIXTO;URBANO;OFICIAL;52323
3,25873E+11;COL COOP PROSPERO PINZON;A;MIXTO;URBANO;NO OFICIAL;25873
1,68176E+11;COLEGIO INTEGRADO INMACULADA CONCEPCION;A;MIXTO;URBANO;OFICIAL;68176
1,68217E+11;COLEGIO TECNICO AGROPECUARIO RAFAEL LEON AMAYA;A;MIXTO;URBANO;OFICIAL;68167
3,11001E+11;INST TENERIFE;A;MIXTO;URBANO;NO OFICIAL;11001
2,19807E+11;I.E. PROMOCION SOCIAL;A;MIXTO;RURAL;OFICIAL;19807
1,70708E+11;I.E.T. DIVERSIFICADO DE BUENAVISTA;A;MIXTO;RURAL;OFICIAL;70708
3,2543E+11;COLEGIO TECNICO SANTO TOMAS;A;MIXTO;URBANO;NO OFICIAL;25430
1,50001E+11;I. E. TECNICA MARCO FIDEL SUAREZ;A;MIXTO;URBANO;OFICIAL;50001
3,47001E+11;INSTITUTO MANUEL JOSE DEL CASTILLO;A;MIXTO;URBANO;NO OFICIAL;47001
3,6617E+11;COLEGIO DIOCESANO MONSENOR BALTASAR ALVAREZ R.;A;MIXTO;URBANO;NO OFICIAL;66170
2,76364E+11;I.E. COMUNITARIA LUIS CARLOS VALENCIA;A;MIXTO;RURAL;OFICIAL;76364
2,70708E+11;INST EDUC PALO ALTO;A;MIXTO;RURAL;OFICIAL;70708
2,13244E+11;I.E. ALTA MONTAÑA;A;MIXTO;RURAL;OFICIAL;13244
3,54001E+11;COL COOP SAN JOSÉ DE PERALTA;A;MIXTO;URBANO;NO OFICIAL;54001
3,68276E+11;COL SANTA ISABEL DE HUNGRIA;A;MIXTO;URBANO;NO OFICIAL;68276
1,05045E+11;I.E. CADENA LAS PLAYAS;A;MIXTO;URBANO;OFICIAL;5045
4,25175E+11;I.E. SANTA MARÍA DEL RIO;A;MIXTO;RURAL;OFICIAL;25175
2,6617E+11;I.E. EDUARDO CORREA URIBE;A;MIXTO;RURAL;OFICIAL;66170
3,15001E+11;COL COOP COOSERVICIOS;A;MIXTO;URBANO;NO OFICIAL;15001
1,05001E+11;INST EDUC EL PLAYON;A;MIXTO;URBANO;OFICIAL;5001
3,05001E+11;COL CREADORES DEL FUTURO;A;MIXTO;URBANO;NO OFICIAL;5001
2,73283E+11;INSTITUCION EDUCATIVA LA AGUADITA;A;MIXTO;RURAL;OFICIAL;73283
1,7387E+11;INSTITUCION EDUCATIVA ESCUELA NORMAL SUPERIOR DE VILLAHERMOSA;A;MIXTO;URBANO;OFICIAL;73870
3,25899E+11;COL FRANCISCO JOSE DE CALDAS;A;MIXTO;URBANO;NO OFICIAL;25899
3,25754E+11;COLEGIO MARIA MAGDALENA;A;MIXTO;URBANO;NO OFICIAL;25754
3,50577E+11;INSTITUCION CETEL;A;MIXTO;URBANO;NO OFICIAL;50577
3,68276E+11;INST DE EDUCACION FORMAL EUSE;A;MIXTO;URBANO;NO OFICIAL;68276
1,50001E+11;COLEGIO ABRAHAM LINCOLN;A;MIXTO;URBANO;OFICIAL;50001
2,05837E+11;I.E. SAN JOSE DE MULATOS;A;MIXTO;RURAL;OFICIAL;5837
3,11001E+11;GIMN CACERES;A;MIXTO;URBANO;NO OFICIAL;11001
2,41016E+11;IE LA CEJA MESITAS;A;MIXTO;RURAL;OFICIAL;41016
3,25473E+11;POLITECNICO DE LA SABANA;A;MIXTO;URBANO;NO OFICIAL;25473
2,1558E+11;IE LA FLORESTA;A;MIXTO;RURAL;OFICIAL;15580
3,18001E+11;GIMNASIO CAMPESTRE DE FLORENCIA;A;MIXTO;URBANO;NO OFICIAL;18001
2,27099E+11;IE LA LOMA DE BOJAYA;A;MIXTO;RURAL;OFICIAL;27099
2,27361E+11;IE JOAQUIN URRUTIA;A;MIXTO;URBANO;OFICIAL;27450
1,25269E+11;I.E.M LA ARBOLEDA;A;MIXTO;URBANO;OFICIAL;25269
3,27361E+11;IE INDÍGENA GERARDO CHIRIPUA VALENCIA;A;MIXTO;RURAL;OFICIAL;27250
3,11001E+11;COLEGIO TECNISISTEMAS;A;MIXTO;URBANO;NO OFICIAL;11001
1,05145E+11;I. E. JUAN PABLO GOMEZ OCHOA;A;MIXTO;URBANO;OFICIAL;5145
3,11001E+11;COL INGLATERRA REAL;A;MIXTO;URBANO;NO OFICIAL;11001
3,11001E+11;COL CASA ACAD CULTURAL;A;MIXTO;URBANO;NO OFICIAL;11001
2,27075E+11;CE INMACULADO CORAZON DE MARIA;A;MIXTO;RURAL;OFICIAL;27075
2,05031E+11;I. E. R. PORTACHUELO;A;MIXTO;RURAL;OFICIAL;5031
1,17001E+11;INSTITUCIÓN EDUCATIVA LICEO MIXTO SINAI;A;MIXTO;URBANO;OFICIAL;17001
2,73585E+11;INSTITUCION EDUCATIVA TECNICA SANTA LUCIA;A;MIXTO;RURAL;OFICIAL;73585
3,41001E+11;COL  HISPANO INGLES;A;MIXTO;URBANO;NO OFICIAL;41001
3,1569E+11;I.E. TEC JACINTO VEGA;A;MIXTO;URBANO;OFICIAL;15690
3,11001E+11;COL MAYOR DEL QUIROGA  (TALLER INF QUIROGA);A;MIXTO;URBANO;NO OFICIAL;11001
2,41551E+11;IE MUNICIPAL PALMARITO;A;MIXTO;RURAL;OFICIAL;41551
3,11001E+11;LIC  ERNESTO CARDENAL;A;MIXTO;URBANO;NO OFICIAL;11001
3,08001E+11;CENTRO EDUCATIVO LAUDES;A;MIXTO;URBANO;NO OFICIAL;8001
3,76001E+11;COLEGIO POLITECNICO SIGLO XXI;A;MIXTO;URBANO;NO OFICIAL;76001
1,73349E+11;INSTITUCION EDUCATIVA TECNICA GENERAL SANTANDER;A;MIXTO;URBANO;OFICIAL;73349
3,85001E+11;GIMNASIO COMFACASANARE;A;MIXTO;URBANO;NO OFICIAL;85001
3,25295E+11;INSTITUTO TÉCNICO LUIS MEDINA NIVIA;A;MIXTO;URBANO;NO OFICIAL;25295
3,11769E+11;COL TECNOLOGICO DE SUBA;A;MIXTO;URBANO;NO OFICIAL;11001
1,68001E+11;IE LA LIBERTAD;A;MIXTO;URBANO;OFICIAL;68276
3,68001E+11;COL MILIT GENERAL SANTANDER;A;MIXTO;URBANO;NO OFICIAL;68001
4,25473E+11;COLEGIO BILINGUE PÍO XII CAMPESTRE;A;MIXTO;URBANO;NO OFICIAL;25473
1,25148E+11;INSTITUCIO EDUCATIVA DEPARTAMENTAL SANTA GEMMA DE GALGANI;A;MIXTO;URBANO;OFICIAL;25148
3,11001E+11;LIC AMERICANO MI GRAN CASA AZUL;A;MIXTO;URBANO;NO OFICIAL;11001
2,47707E+11;INSTITUCION EDUCATIVA DEPARTAMENTAL SAN JOSE DE SAN FERNANDO;A;MIXTO;RURAL;OFICIAL;47707
2,23001E+11;INSTITUCIÓN EDUCATIVA CAÑO VIEJO PALOTAL;A;MIXTO;RURAL;OFICIAL;23001
2,54206E+11;CENT EDUC RUR LA TRINIDAD;A;MIXTO;RURAL;OFICIAL;54206
3,76622E+11;COL GIMNASIO LOS ALPES;A;MIXTO;URBANO;NO OFICIAL;76622
3,05001E+11;CENT EDUC AUTONOMO;A;MIXTO;URBANO;NO OFICIAL;5425
3,52835E+11;COLEGIO TECNICO MILITAR ALMIRANTE TONO TUMACO SAS;A;MIXTO;URBANO;NO OFICIAL;52835
3,11001E+11;GIMN MIX MANUEL DEL SOCORRO RODRIGUEZ;A;MIXTO;URBANO;NO OFICIAL;11001
2,13667E+11;I.E. DE PLAYITAS;A;MIXTO;RURAL;OFICIAL;13667
3,76364E+11;COL LA MERCED;A;MIXTO;URBANO;NO OFICIAL;76364
4,25279E+11;INSTITUCION EDUCATIVA DEPARTAMENTAL I.P.E.B.I.;A;MIXTO;RURAL;OFICIAL;25279
1,25718E+11;INSTITUCION EDUCATIVA DEPARTAMENTAL SAN NICOLAS;A;MIXTO;URBANO;OFICIAL;25718
1,05001E+11;INST EDUC CRISTO REY;A;MIXTO;URBANO;OFICIAL;5001
3,11001E+11;COLEGIO SAGRADO CORAZON;A;MIXTO;URBANO;NO OFICIAL;11001
2,13074E+11;I.E. SAGRADO CORAZON DE JESUS;A;MIXTO;RURAL;OFICIAL;13030
2,0544E+11;I E R ROSALIA HOYOS;A;MIXTO;RURAL;OFICIAL;5440
2,17001E+11;INSTITUCION EDUCATIVA RURAL LA VIOLETA;A;MIXTO;RURAL;OFICIAL;17001
1,63594E+11;SIMON BOLIVAR;A;MIXTO;URBANO;OFICIAL;63594
2,73283E+11;INSTITUCION EDUCATIVA TECNICA AGROPECUARIA EL GUAYABO;A;MIXTO;RURAL;OFICIAL;73283
2,81794E+11;I.E. ANTONIO RICAURTE;A;MIXTO;RURAL;OFICIAL;81794
3,76041E+11;COL PARROQUIAL NUESTRA SEÑORA DE FÁTIMA;A;MIXTO;URBANO;NO OFICIAL;76041
2,05674E+11;I.E.R. SANTA RITA;A;MIXTO;RURAL;OFICIAL;5674
4,86001E+11;I.E.R. MAYOYOQUE;A;MIXTO;RURAL;OFICIAL;86571
3,11001E+11;COL PARROQ SAN JUAN BAUTISTA DE LA SALLE;A;MIXTO;URBANO;NO OFICIAL;11001
3,25245E+11;COLEGIO FRAY CRISTOBAL DE TORRES;A;MIXTO;URBANO;NO OFICIAL;25245
2,73236E+11;INSTITUCION EDUCATIVA SAN PEDRO;A;MIXTO;RURAL;OFICIAL;73236
1,41001E+11;JUAN DE CABRERA;A;MIXTO;URBANO;OFICIAL;41001
3,76001E+11;LICEO SAN JOSÉ;A;MIXTO;URBANO;NO OFICIAL;76001
2,6802E+11;INSTITUTO INTEGRADO DE COMERCIO EL HATILLO;A;MIXTO;RURAL;OFICIAL;68020
3,44001E+11;COLEGIO SIGLO XXI;A;MIXTO;URBANO;NO OFICIAL;44001
2,15632E+11;IE SAN MARCOS;A;MIXTO;RURAL;OFICIAL;15632
1,8386E+11;I.E VALPARAISO;A;MIXTO;URBANO;OFICIAL;18860
3,54001E+11;COL GIMN DOMINGO SAVIO;A;MIXTO;URBANO;NO OFICIAL;54001
3,25269E+11;INSTITUTO MARIO LUIS RODRIGUEZ COBOS;A;MIXTO;URBANO;NO OFICIAL;25269
3,11001E+11;COL PSICOPEDAG AMERICANO DEL SUR;A;MIXTO;URBANO;NO OFICIAL;11001
2,47189E+11;I.E. ALFREDO CORREA DE ANDREIS;A;MIXTO;URBANO;OFICIAL;47189
4,25377E+11;GIMNASIO CAMPESTRE LOS ARRAYANES;A;MIXTO;RURAL;NO OFICIAL;25322
1,50001E+11;INSTITUCION EDUCATIVA COLEGIO DEPARTAMENTAL SAN FRANCISCO DE ASIS;A;MIXTO;URBANO;OFICIAL;50001
1,76828E+11;IE JULIAN TRUJILLO;A;MIXTO;RURAL;OFICIAL;76828
3,11001E+11;LICEO SANTA ISABEL;A;MIXTO;URBANO;NO OFICIAL;11001
3,05631E+11;GIMNASIO LOS ALCAZARES JORNADA ADICIONAL;A;MASCULINO;URBANO;NO OFICIAL;5266
3,47001E+11;COLEGIO MARIA AUXILIADORA;A;MIXTO;URBANO;NO OFICIAL;47001
3,11001E+11;GIMNASIO BOLÍVAR;OTRO;MIXTO;URBANO;NO OFICIAL;11001
1,50226E+11;IE TENIENTE CRUZ PAREDES;A;MIXTO;URBANO;OFICIAL;50226
3,66001E+11;COL SAN JOSE;A;MIXTO;URBANO;NO OFICIAL;66001
2,1945E+11;I.E.A. ISRAEL MARÍA NARVÁEZ;A;MIXTO;RURAL;OFICIAL;19450
3,11001E+11;LIC LATINOAMERICANO;A;MIXTO;URBANO;NO OFICIAL;11001
2,66687E+11;CE BACHILLERATO EN BIENESTAR RURAL -SANTUARIO-;A;MIXTO;RURAL;OFICIAL;66687
3,19001E+11;REAL COL SAN JOSE;A;MIXTO;URBANO;NO OFICIAL;19001
1,19573E+11;I.E. JOSE HILARIO LOPEZ;A;MIXTO;URBANO;OFICIAL;19573
3,50569E+11;INSTITUCIÓN EDUCATIVA INSELLANOS;A;MIXTO;URBANO;NO OFICIAL;50568
2,70215E+11;INST EDUC SAN FRANCISCO;A;MIXTO;RURAL;OFICIAL;70233
4,1913E+11;I.E. AGROPECUARIA NUESTRA SEÑORA DEL ROSARIO;A;MIXTO;RURAL;OFICIAL;19130
3,25473E+11;COLEGIO COOPERATIVO TOMAS CIPRIANO DE MOSQUERA;A;MIXTO;URBANO;NO OFICIAL;25473
2,70742E+11;I.E. DE GRANADA;A;MIXTO;RURAL;OFICIAL;70742
2,17541E+11;INSTITUCION EDUCATIVA DANIEL MARIA LOPEZ RODRIGUEZ;A;MIXTO;RURAL;OFICIAL;17541
3,25308E+11;COLEGIO MAHATMA GANDHI DE GIRARDOT;A;MIXTO;URBANO;NO OFICIAL;25307
2,70215E+11;I.E.T. AGRO ANIBAL GANDARA CAMPO;A;MIXTO;RURAL;OFICIAL;70233
3,50001E+11;COL ADVENTISTA DE VILLAVICENCIO;A;MIXTO;URBANO;NO OFICIAL;50001
2,05306E+11;I.E.R. SANTA ROSA DE LIMA;A;MIXTO;RURAL;OFICIAL;5306
3,11265E+11;INST MAYEUTICO;A;MIXTO;URBANO;NO OFICIAL;11001
2,7652E+11;IE MONSEÑOR JOSE MANUEL SALCEDO;A;MIXTO;RURAL;OFICIAL;76130
3,68001E+11;COL SAN VICENTE FERRER;A;MIXTO;URBANO;NO OFICIAL;68001
2,73001E+11;INSTITUCION EDUC TAPIAS;A;MIXTO;RURAL;OFICIAL;73001
2,0567E+11;I. E. R. CRISTALES;A;MIXTO;RURAL;OFICIAL;5670
3,47001E+11;INSTITUTO JEAN PIAGET;A;MIXTO;URBANO;NO OFICIAL;47001
1,41001E+11;RICARDO BORRERO ALVAREZ;A;MIXTO;URBANO;OFICIAL;41001
1,66001E+11;I.E. SURORIENTAL;A;MIXTO;URBANO;OFICIAL;66001
2,76001E+11;INSTITUCION EDUCATIVA PANCE;A;MIXTO;RURAL;OFICIAL;76001
4,25645E+11;GIMNASIO CAMPESTRE EDUCACIÓN DINÁMICA;A;MIXTO;RURAL;NO OFICIAL;25645
2,27615E+11;CE SIMON BOLIVAR;A;MIXTO;RURAL;OFICIAL;27615
4,68444E+11;COLEGIO TECNICO AGROPECUARIO  NUESTRA SEÑORA DE LA PAZ;A;MIXTO;RURAL;OFICIAL;68444
3,41396E+11;CENTRO POLITECNICO JOSE CELESTINO MUTIS;A;MIXTO;URBANO;NO OFICIAL;41396
3,11001E+11;COL NSTRA SRA DE LORETO;A;MIXTO;URBANO;NO OFICIAL;11001
2,73217E+11;INSTITUCION EDUCATIVA COYARCÓ;A;MIXTO;RURAL;OFICIAL;73217
3,25269E+11;COLEGIO EL LIBERTADOR;A;MIXTO;URBANO;NO OFICIAL;25269
1,20614E+11;I.E. ALFONSO LOPEZ;A;MIXTO;URBANO;OFICIAL;20614
3,68276E+11;GIMN COLOMBIANITOS DEL MAÑANA;A;MIXTO;URBANO;NO OFICIAL;68276
2,05148E+11;I. E. SANTA MARIA;A;MIXTO;RURAL;OFICIAL;5148
3,11001E+11;INST CULT RAFAEL MAYA;A;MIXTO;URBANO;NO OFICIAL;11001
2,4772E+11;INSTITUCION EDUCATIVA DEPARTAMENTAL RURAL SAGRADO CORAZON DE JESUS;A;MIXTO;RURAL;OFICIAL;47720
3,11848E+11;COL MILITAR CALDAS;A;MIXTO;URBANO;NO OFICIAL;11001
1,05001E+11;INST EDUC ALCALDIA DE MEDELLIN;A;MIXTO;URBANO;OFICIAL;5001
1,20001E+11;CORP EDUC LICEO MODERNO;A;MIXTO;URBANO;NO OFICIAL;20001
3,25377E+11;COLEGIO NUEVA ESPERANZA;A;MIXTO;URBANO;NO OFICIAL;25377
3,15176E+11;GIMNASIO CRISTIANO JESUCRISTO ES EL REY;A;MIXTO;URBANO;NO OFICIAL;15176
4,25175E+11;ZION SCHOOL;A;MIXTO;RURAL;NO OFICIAL;11001
3,11001E+11;LIC GOLDEN RULE;A;MIXTO;URBANO;NO OFICIAL;11001
3,52001E+11;COLEGIO MUNDO DE PRAGA;A;MIXTO;URBANO;NO OFICIAL;52001
4,25214E+11;GIMN CAMP LOS SAUCES;A;MIXTO;RURAL;NO OFICIAL;25214
3,47001E+11;CORPORACION TECNICA DEL MAGDALENA;A;MIXTO;URBANO;NO OFICIAL;47001
3,68307E+11;INSTITUTO DE FORMACION EDUCATIVA IFE;A;MIXTO;URBANO;NO OFICIAL;68307
3,25269E+11;FUNDACIÓN EDUCATIVA SURAMERICANA S.A.S FESUR;A;MIXTO;URBANO;NO OFICIAL;25269
